00:38:28.786101 IP (tos 0xc0, ttl 1, id 20138, offset 0, flags [none], proto IGMP (2), length 32, options (RA))
    ae3--2888.uwar-atg-1.infra.washington.edu > 224.0.0.252: igmp query v2 [max resp time 10] [gaddr 224.0.0.252]
00:38:28.786418 IP (tos 0xc0, ttl 1, id 20336, offset 0, flags [none], proto IGMP (2), length 32, options (RA))
    ae3--2888.uwar-atg-1.infra.washington.edu > 224.0.0.252: igmp query v2 [max resp time 10] [gaddr 224.0.0.252]
00:38:28.787716 IP (tos 0x0, ttl 81, id 57816, offset 0, flags [DF], proto TCP (6), length 533)
    channel-proxy-shv-04-frc3.facebook.com.https > d-69-91-181-31.dhcp4.washington.edu.54443: Flags [P.], cksum 0x7adf (correct), seq 3723724699:3723725180, ack 3713317952, win 227, options [nop,nop,TS val 1934682747 ecr 205153097], length 481
00:38:28.787768 ARP, Ethernet (len 6), IPv4 (len 4), Request who-has ae3--2888.uwar-atg-1.infra.washington.edu (00:00:5e:00:01:05 (oui Unknown)) tell d-69-91-181-31.dhcp4.washington.edu, length 28
00:38:28.789019 ARP, Ethernet (len 6), IPv4 (len 4), Reply ae3--2888.uwar-atg-1.infra.washington.edu is-at 00:00:5e:00:01:05 (oui Unknown), length 42
00:38:28.789060 IP (tos 0x0, ttl 64, id 2429, offset 0, flags [DF], proto TCP (6), length 52)
    d-69-91-181-31.dhcp4.washington.edu.54443 > channel-proxy-shv-04-frc3.facebook.com.https: Flags [.], cksum 0xdc88 (correct), ack 481, win 8161, options [nop,nop,TS val 205202776 ecr 1934682747], length 0
00:38:28.795611 IP (tos 0x0, ttl 64, id 4382, offset 0, flags [DF], proto TCP (6), length 647)
    d-69-91-181-31.dhcp4.washington.edu.54443 > channel-proxy-shv-04-frc3.facebook.com.https: Flags [P.], cksum 0x7323 (correct), seq 1:596, ack 481, win 8192, options [nop,nop,TS val 205202783 ecr 1934682747], length 595
00:38:28.861743 IP (tos 0x0, ttl 81, id 57817, offset 0, flags [DF], proto TCP (6), length 52)
    channel-proxy-shv-04-frc3.facebook.com.https > d-69-91-181-31.dhcp4.washington.edu.54443: Flags [.], cksum 0xf894 (correct), ack 596, win 238, options [nop,nop,TS val 1934682888 ecr 205202783], length 0
00:38:29.401691 IP (tos 0x0, ttl 81, id 33229, offset 0, flags [DF], proto TCP (6), length 137)
    channel-proxy-shv-04-frc3.facebook.com.https > d-69-91-181-31.dhcp4.washington.edu.54442: Flags [P.], cksum 0xb17d (correct), seq 1608805410:1608805495, ack 3184842503, win 220, options [nop,nop,TS val 2709008692 ecr 205153399], length 85
00:38:29.401696 IP (tos 0x0, ttl 81, id 33230, offset 0, flags [DF], proto TCP (6), length 121)
    channel-proxy-shv-04-frc3.facebook.com.https > d-69-91-181-31.dhcp4.washington.edu.54442: Flags [P.], cksum 0x6e74 (correct), seq 85:154, ack 1, win 220, options [nop,nop,TS val 2709008692 ecr 205153399], length 69
00:38:29.401776 IP (tos 0x0, ttl 64, id 26043, offset 0, flags [DF], proto TCP (6), length 52)
    d-69-91-181-31.dhcp4.washington.edu.54442 > channel-proxy-shv-04-frc3.facebook.com.https: Flags [.], cksum 0x04fb (correct), ack 85, win 8186, options [nop,nop,TS val 205203387 ecr 2709008692], length 0
00:38:29.401776 IP (tos 0x0, ttl 64, id 40557, offset 0, flags [DF], proto TCP (6), length 52)
    d-69-91-181-31.dhcp4.washington.edu.54442 > channel-proxy-shv-04-frc3.facebook.com.https: Flags [.], cksum 0x04ba (correct), ack 154, win 8182, options [nop,nop,TS val 205203387 ecr 2709008692], length 0
00:38:29.405621 IP (tos 0x0, ttl 64, id 47141, offset 0, flags [DF], proto TCP (6), length 1321)
    d-69-91-181-31.dhcp4.washington.edu.54442 > channel-proxy-shv-04-frc3.facebook.com.https: Flags [P.], cksum 0x0b36 (correct), seq 1:1270, ack 154, win 8192, options [nop,nop,TS val 205203391 ecr 2709008692], length 1269
00:38:29.471130 IP (tos 0x0, ttl 81, id 33231, offset 0, flags [DF], proto TCP (6), length 52)
    channel-proxy-shv-04-frc3.facebook.com.https > d-69-91-181-31.dhcp4.washington.edu.54442: Flags [.], cksum 0x1e28 (correct), ack 1270, win 231, options [nop,nop,TS val 2709008860 ecr 205203391], length 0
00:38:29.471759 IP (tos 0x0, ttl 81, id 33232, offset 0, flags [DF], proto TCP (6), length 308)
    channel-proxy-shv-04-frc3.facebook.com.https > d-69-91-181-31.dhcp4.washington.edu.54442: Flags [.], cksum 0x1e28 (correct), seq 154:410, ack 1270, win 231, options [nop,nop,TS val 2709008860 ecr 205203391], length 256
00:38:29.471852 IP (tos 0x0, ttl 81, id 33233, offset 0, flags [DF], proto TCP (6), length 233)
    channel-proxy-shv-04-frc3.facebook.com.https > d-69-91-181-31.dhcp4.washington.edu.54442: Flags [P.], cksum 0xb896 (correct), seq 410:591, ack 1270, win 231, options [nop,nop,TS val 2709008860 ecr 205203391], length 181
00:38:29.471900 IP (tos 0x0, ttl 64, id 842, offset 0, flags [DF], proto TCP (6), length 52)
    d-69-91-181-31.dhcp4.washington.edu.54442 > channel-proxy-shv-04-frc3.facebook.com.https: Flags [.], cksum 0xfd24 (correct), ack 591, win 8180, options [nop,nop,TS val 205203456 ecr 2709008860], length 0
00:38:29.472353 IP (tos 0x0, ttl 81, id 33234, offset 0, flags [DF], proto TCP (6), length 137)
    channel-proxy-shv-04-frc3.facebook.com.https > d-69-91-181-31.dhcp4.washington.edu.54442: Flags [P.], cksum 0x267b (correct), seq 591:676, ack 1270, win 231, options [nop,nop,TS val 2709008861 ecr 205203391], length 85
00:38:29.472384 IP (tos 0x0, ttl 64, id 18983, offset 0, flags [DF], proto TCP (6), length 52)
    d-69-91-181-31.dhcp4.washington.edu.54442 > channel-proxy-shv-04-frc3.facebook.com.https: Flags [.], cksum 0xfcc7 (correct), ack 676, win 8186, options [nop,nop,TS val 205203457 ecr 2709008861], length 0
00:38:29.810001 IP (tos 0xc0, ttl 1, id 28166, offset 0, flags [none], proto IGMP (2), length 32, options (RA))
    ae3--2888.uwar-atg-1.infra.washington.edu > 224.0.0.252: igmp query v2 [max resp time 10] [gaddr 224.0.0.252]
00:38:31.141267 IP (tos 0xc0, ttl 1, id 37639, offset 0, flags [none], proto IGMP (2), length 32, options (RA))
    ae3--2888.uwar-atg-1.infra.washington.edu > 224.0.0.113: igmp query v2 [max resp time 10] [gaddr 224.0.0.113]
00:38:32.165257 IP (tos 0xc0, ttl 1, id 45557, offset 0, flags [none], proto IGMP (2), length 32, options (RA))
    ae3--2888.uwar-atg-1.infra.washington.edu > 224.0.0.113: igmp query v2 [max resp time 10] [gaddr 224.0.0.113]
00:38:32.779648 IP (tos 0xc0, ttl 1, id 49958, offset 0, flags [none], proto IGMP (2), length 32, options (RA))
    ae3--2888.uwar-atg-1.infra.washington.edu > 224.0.0.252: igmp query v2 [max resp time 10] [gaddr 224.0.0.252]
00:38:32.882097 IP (tos 0xc0, ttl 1, id 50133, offset 0, flags [none], proto IGMP (2), length 32, options (RA))
    ae3--2888.uwar-atg-1.infra.washington.edu > 224.0.0.252: igmp query v2 [max resp time 10] [gaddr 224.0.0.252]
00:38:33.803613 IP (tos 0xc0, ttl 1, id 57980, offset 0, flags [none], proto IGMP (2), length 32, options (RA))
    ae3--2888.uwar-atg-1.infra.washington.edu > 224.0.0.252: igmp query v2 [max resp time 10] [gaddr 224.0.0.252]
00:38:36.773778 ARP, Ethernet (len 6), IPv4 (len 4), Request who-has d-69-91-149-72.dhcp4.washington.edu tell d-69-91-149-72.dhcp4.washington.edu, length 42
00:38:37.183455 ARP, Ethernet (len 6), IPv4 (len 4), Request who-has d-108-179-178-127.dhcp4.washington.edu tell d-108-179-178-127.dhcp4.washington.edu, length 42
00:38:37.490508 IP (tos 0xc0, ttl 1, id 24881, offset 0, flags [none], proto IGMP (2), length 32, options (RA))
    ae3--2888.uwar-atg-1.infra.washington.edu > 224.0.0.113: igmp query v2 [max resp time 10] [gaddr 224.0.0.113]
00:38:37.593001 ARP, Ethernet (len 6), IPv4 (len 4), Request who-has d-128-95-62-69.dhcp4.washington.edu tell d-128-95-62-69.dhcp4.washington.edu, length 42
00:38:38.132480 IP (tos 0x0, ttl 255, id 47812, offset 0, flags [none], proto UDP (17), length 74)
    d-69-91-181-31.dhcp4.washington.edu.50130 > dns1.cac.washington.edu.domain: 28252+ PTR? 127.178.179.108.in-addr.arpa. (46)
00:38:38.134927 IP (tos 0x0, ttl 59, id 189, offset 0, flags [none], proto UDP (17), length 274)
    dns1.cac.washington.edu.domain > d-69-91-181-31.dhcp4.washington.edu.50130: 28252* 1/3/4 127.178.179.108.in-addr.arpa. PTR D-108-179-178-127.dhcp4.washington.edu. (246)
00:38:38.135523 IP (tos 0x0, ttl 255, id 60130, offset 0, flags [none], proto UDP (17), length 71)
    d-69-91-181-31.dhcp4.washington.edu.59186 > dns1.cac.washington.edu.domain: 33133+ PTR? 69.62.95.128.in-addr.arpa. (43)
00:38:38.137846 IP (tos 0x0, ttl 59, id 190, offset 0, flags [none], proto UDP (17), length 268)
    dns1.cac.washington.edu.domain > d-69-91-181-31.dhcp4.washington.edu.59186: 33133* 1/3/4 69.62.95.128.in-addr.arpa. PTR D-128-95-62-69.dhcp4.washington.edu. (240)
00:38:38.514673 IP (tos 0xc0, ttl 1, id 34688, offset 0, flags [none], proto IGMP (2), length 32, options (RA))
    ae3--2888.uwar-atg-1.infra.washington.edu > 224.0.0.113: igmp query v2 [max resp time 10] [gaddr 224.0.0.113]
00:38:38.719500 ARP, Ethernet (len 6), IPv4 (len 4), Request who-has d-69-91-181-110.dhcp4.washington.edu tell d-69-91-181-110.dhcp4.washington.edu, length 42
00:38:38.719507 IP (tos 0xc0, ttl 1, id 37125, offset 0, flags [none], proto IGMP (2), length 32, options (RA))
    ae3--2888.uwar-atg-1.infra.washington.edu > 224.0.0.252: igmp query v2 [max resp time 10] [gaddr 224.0.0.252]
00:38:38.924271 IP (tos 0xc0, ttl 1, id 38306, offset 0, flags [none], proto IGMP (2), length 32, options (RA))
    ae3--2888.uwar-atg-1.infra.washington.edu > 224.0.0.252: igmp query v2 [max resp time 10] [gaddr 224.0.0.252]
00:38:39.139601 IP (tos 0x0, ttl 255, id 35591, offset 0, flags [none], proto UDP (17), length 72)
    d-69-91-181-31.dhcp4.washington.edu.64547 > dns1.cac.washington.edu.domain: 49459+ PTR? 110.181.91.69.in-addr.arpa. (44)
00:38:39.143123 IP (tos 0x0, ttl 59, id 191, offset 0, flags [none], proto UDP (17), length 270)
    dns1.cac.washington.edu.domain > d-69-91-181-31.dhcp4.washington.edu.64547: 49459* 1/3/4 110.181.91.69.in-addr.arpa. PTR D-69-91-181-110.dhcp4.washington.edu. (242)
00:38:39.846135 IP (tos 0xc0, ttl 1, id 48215, offset 0, flags [none], proto IGMP (2), length 32, options (RA))
    ae3--2888.uwar-atg-1.infra.washington.edu > 224.0.0.252: igmp query v2 [max resp time 10] [gaddr 224.0.0.252]
00:38:40.665057 ARP, Ethernet (len 6), IPv4 (len 4), Request who-has d-69-91-181-110.dhcp4.washington.edu tell d-69-91-181-110.dhcp4.washington.edu, length 42
00:38:41.074676 IP (tos 0xc0, ttl 1, id 58752, offset 0, flags [none], proto IGMP (2), length 32, options (RA))
    ae3--2888.uwar-atg-1.infra.washington.edu > 224.0.0.252: igmp query v2 [max resp time 10] [gaddr 224.0.0.252]
00:38:41.176970 IP (tos 0xc0, ttl 1, id 58813, offset 0, flags [none], proto IGMP (2), length 32, options (RA))
    ae3--2888.uwar-atg-1.infra.washington.edu > 224.0.0.252: igmp query v2 [max resp time 10] [gaddr 224.0.0.252]
00:38:41.893795 IP (tos 0xc0, ttl 1, id 247, offset 0, flags [none], proto IGMP (2), length 32, options (RA))
    ae3--2888.uwar-atg-1.infra.washington.edu > 224.0.0.252: igmp query v2 [max resp time 10] [gaddr 224.0.0.252]
00:38:41.893824 IP (tos 0xc0, ttl 1, id 529, offset 0, flags [none], proto IGMP (2), length 32, options (RA))
    ae3--2888.uwar-atg-1.infra.washington.edu > 224.0.0.252: igmp query v2 [max resp time 10] [gaddr 224.0.0.252]
00:38:42.917793 IP (tos 0xc0, ttl 1, id 8901, offset 0, flags [none], proto IGMP (2), length 32, options (RA))
    ae3--2888.uwar-atg-1.infra.washington.edu > 224.0.0.252: igmp query v2 [max resp time 10] [gaddr 224.0.0.252]
00:38:43.020350 IP (tos 0xc0, ttl 1, id 9662, offset 0, flags [none], proto IGMP (2), length 32, options (RA))
    ae3--2888.uwar-atg-1.infra.washington.edu > 224.0.0.252: igmp query v2 [max resp time 10] [gaddr 224.0.0.252]
00:38:43.225421 IP (tos 0xc0, ttl 1, id 10432, offset 0, flags [none], proto IGMP (2), length 32, options (RA))
    ae3--2888.uwar-atg-1.infra.washington.edu > 224.0.0.113: igmp query v2 [max resp time 10] [gaddr 224.0.0.113]
00:38:44.146555 IP (tos 0xc0, ttl 1, id 18079, offset 0, flags [none], proto IGMP (2), length 32, options (RA))
    ae3--2888.uwar-atg-1.infra.washington.edu > 224.0.0.113: igmp query v2 [max resp time 10] [gaddr 224.0.0.113]
00:38:44.249102 IP (tos 0xc0, ttl 1, id 18544, offset 0, flags [none], proto IGMP (2), length 32, options (RA))
    ae3--2888.uwar-atg-1.infra.washington.edu > 224.0.0.252: igmp query v2 [max resp time 10] [gaddr 224.0.0.252]
00:38:45.375358 IP (tos 0xc0, ttl 1, id 25948, offset 0, flags [none], proto IGMP (2), length 32, options (RA))
    ae3--2888.uwar-atg-1.infra.washington.edu > 224.0.0.252: igmp query v2 [max resp time 10] [gaddr 224.0.0.252]
00:38:46.296917 ARP, Ethernet (len 6), IPv4 (len 4), Request who-has d-108-179-145-198.dhcp4.washington.edu tell d-108-179-145-198.dhcp4.washington.edu, length 42
00:38:46.399960 IP (tos 0xc0, ttl 1, id 31612, offset 0, flags [none], proto IGMP (2), length 32, options (RA))
    ae3--2888.uwar-atg-1.infra.washington.edu > 224.0.0.252: igmp query v2 [max resp time 10] [gaddr 224.0.0.252]
00:38:46.502485 IP (tos 0xc0, ttl 1, id 32206, offset 0, flags [none], proto IGMP (2), length 32, options (RA))
    ae3--2888.uwar-atg-1.infra.washington.edu > 224.0.0.252: igmp query v2 [max resp time 10] [gaddr 224.0.0.252]
00:38:46.605954 IP (tos 0x0, ttl 56, id 4794, offset 0, flags [none], proto TCP (6), length 117)
    sea09s16-in-f8.1e100.net.https > d-69-91-181-31.dhcp4.washington.edu.54457: Flags [P.], cksum 0xf974 (correct), seq 4225207701:4225207766, ack 2027957630, win 408, options [nop,nop,TS val 1369262511 ecr 204980853], length 65
00:38:46.606029 ARP, Ethernet (len 6), IPv4 (len 4), Request who-has ae3--2888.uwar-atg-1.infra.washington.edu (00:00:5e:00:01:05 (oui Unknown)) tell d-69-91-181-31.dhcp4.washington.edu, length 28
00:38:46.606229 IP (tos 0x0, ttl 56, id 4795, offset 0, flags [none], proto TCP (6), length 97)
    sea09s16-in-f8.1e100.net.https > d-69-91-181-31.dhcp4.washington.edu.54457: Flags [FP.], cksum 0x66b1 (correct), seq 65:110, ack 1, win 408, options [nop,nop,TS val 1369262511 ecr 204980853], length 45
00:38:46.607341 ARP, Ethernet (len 6), IPv4 (len 4), Reply ae3--2888.uwar-atg-1.infra.washington.edu is-at 00:00:5e:00:01:05 (oui Unknown), length 42
00:38:46.607377 IP (tos 0x0, ttl 64, id 48930, offset 0, flags [DF], proto TCP (6), length 52)
    d-69-91-181-31.dhcp4.washington.edu.54457 > sea09s16-in-f8.1e100.net.https: Flags [F.], cksum 0x73fb (correct), seq 1, ack 111, win 8192, options [nop,nop,TS val 205220580 ecr 1369262511], length 0
00:38:46.608751 IP (tos 0x0, ttl 56, id 4796, offset 0, flags [none], proto TCP (6), length 52)
    sea09s16-in-f8.1e100.net.https > d-69-91-181-31.dhcp4.washington.edu.54457: Flags [.], cksum 0x924e (correct), ack 2, win 408, options [nop,nop,TS val 1369262532 ecr 205220580], length 0
00:38:47.153654 IP (tos 0x0, ttl 255, id 17325, offset 0, flags [none], proto UDP (17), length 73)
    d-69-91-181-31.dhcp4.washington.edu.63912 > dns1.cac.washington.edu.domain: 45312+ PTR? 104.33.194.173.in-addr.arpa. (45)
00:38:47.157819 IP (tos 0x0, ttl 59, id 192, offset 0, flags [none], proto UDP (17), length 257)
    dns1.cac.washington.edu.domain > d-69-91-181-31.dhcp4.washington.edu.63912: 45312 1/4/4 104.33.194.173.in-addr.arpa. PTR sea09s16-in-f8.1e100.net. (229)
00:38:47.526650 IP (tos 0xc0, ttl 1, id 38098, offset 0, flags [none], proto IGMP (2), length 32, options (RA))
    ae3--2888.uwar-atg-1.infra.washington.edu > 224.0.0.252: igmp query v2 [max resp time 10] [gaddr 224.0.0.252]
00:38:47.731519 IP (tos 0xc0, ttl 1, id 39257, offset 0, flags [none], proto IGMP (2), length 32, options (RA))
    ae3--2888.uwar-atg-1.infra.washington.edu > 224.0.0.252: igmp query v2 [max resp time 10] [gaddr 224.0.0.252]
00:38:47.731846 IP (tos 0xc0, ttl 1, id 39682, offset 0, flags [none], proto IGMP (2), length 32, options (RA))
    ae3--2888.uwar-atg-1.infra.washington.edu > 224.0.0.252: igmp query v2 [max resp time 10] [gaddr 224.0.0.252]
00:38:48.755305 ARP, Ethernet (len 6), IPv4 (len 4), Request who-has d-69-91-177-203.dhcp4.washington.edu tell d-69-91-177-203.dhcp4.washington.edu, length 42
00:38:48.755312 IP (tos 0xc0, ttl 1, id 46083, offset 0, flags [none], proto IGMP (2), length 32, options (RA))
    ae3--2888.uwar-atg-1.infra.washington.edu > 224.0.0.252: igmp query v2 [max resp time 10] [gaddr 224.0.0.252]
00:38:48.755541 ARP, Ethernet (len 6), IPv4 (len 4), Request who-has d-128-95-62-112.dhcp4.washington.edu tell d-128-95-62-112.dhcp4.washington.edu, length 42
00:38:49.472113 IP (tos 0xc0, ttl 1, id 50263, offset 0, flags [none], proto IGMP (2), length 32, options (RA))
    ae3--2888.uwar-atg-1.infra.washington.edu > 224.0.0.113: igmp query v2 [max resp time 10] [gaddr 224.0.0.113]
00:38:49.983948 IP (tos 0xc0, ttl 1, id 53566, offset 0, flags [none], proto IGMP (2), length 32, options (RA))
    ae3--2888.uwar-atg-1.infra.washington.edu > 224.0.0.252: igmp query v2 [max resp time 10] [gaddr 224.0.0.252]
00:38:49.984171 IP (tos 0xc0, ttl 1, id 53702, offset 0, flags [none], proto IGMP (2), length 32, options (RA))
    ae3--2888.uwar-atg-1.infra.washington.edu > 224.0.0.252: igmp query v2 [max resp time 10] [gaddr 224.0.0.252]
00:38:50.291512 ARP, Ethernet (len 6), IPv4 (len 4), Request who-has d-173-250-177-167.dhcp4.washington.edu tell d-173-250-177-167.dhcp4.washington.edu, length 42
00:38:50.496277 IP (tos 0xc0, ttl 1, id 57460, offset 0, flags [none], proto IGMP (2), length 32, options (RA))
    ae3--2888.uwar-atg-1.infra.washington.edu > 224.0.0.113: igmp query v2 [max resp time 10] [gaddr 224.0.0.113]
00:38:50.803169 ARP, Ethernet (len 6), IPv4 (len 4), Request who-has d-69-91-177-203.dhcp4.washington.edu tell d-69-91-177-203.dhcp4.washington.edu, length 42
00:38:50.803423 ARP, Ethernet (len 6), IPv4 (len 4), Request who-has d-128-95-62-112.dhcp4.washington.edu tell d-128-95-62-112.dhcp4.washington.edu, length 42
00:38:51.008072 IP (tos 0xc0, ttl 1, id 61196, offset 0, flags [none], proto IGMP (2), length 32, options (RA))
    ae3--2888.uwar-atg-1.infra.washington.edu > 224.0.0.252: igmp query v2 [max resp time 10] [gaddr 224.0.0.252]
00:38:51.163386 IP (tos 0x0, ttl 255, id 38570, offset 0, flags [none], proto UDP (17), length 74)
    d-69-91-181-31.dhcp4.washington.edu.60534 > dns1.cac.washington.edu.domain: 60823+ PTR? 167.177.250.173.in-addr.arpa. (46)
00:38:51.165853 IP (tos 0x0, ttl 59, id 193, offset 0, flags [none], proto UDP (17), length 202)
    dns1.cac.washington.edu.domain > d-69-91-181-31.dhcp4.washington.edu.60534: 60823* 1/2/2 167.177.250.173.in-addr.arpa. PTR D-173-250-177-167.dhcp4.washington.edu. (174)
00:38:51.724766 ARP, Ethernet (len 6), IPv4 (len 4), Request who-has d-173-250-177-167.dhcp4.washington.edu tell d-173-250-177-167.dhcp4.washington.edu, length 42
00:38:52.031965 IP (tos 0xc0, ttl 1, id 4495, offset 0, flags [none], proto IGMP (2), length 32, options (RA))
    ae3--2888.uwar-atg-1.infra.washington.edu > 224.0.0.252: igmp query v2 [max resp time 10] [gaddr 224.0.0.252]
00:38:52.032627 IP (tos 0xc0, ttl 1, id 4724, offset 0, flags [none], proto IGMP (2), length 32, options (RA))
    ae3--2888.uwar-atg-1.infra.washington.edu > 224.0.0.252: igmp query v2 [max resp time 10] [gaddr 224.0.0.252]
00:38:53.055962 IP (tos 0xc0, ttl 1, id 13692, offset 0, flags [none], proto IGMP (2), length 32, options (RA))
    ae3--2888.uwar-atg-1.infra.washington.edu > 224.0.0.252: igmp query v2 [max resp time 10] [gaddr 224.0.0.252]
00:38:55.308706 ARP, Ethernet (len 6), IPv4 (len 4), Request who-has d-128-95-134-27.dhcp4.washington.edu tell d-128-95-134-27.dhcp4.washington.edu, length 42
00:38:55.513554 IP (tos 0xc0, ttl 1, id 35136, offset 0, flags [none], proto IGMP (2), length 32, options (RA))
    ae3--2888.uwar-atg-1.infra.washington.edu > 224.0.0.252: igmp query v2 [max resp time 10] [gaddr 224.0.0.252]
00:38:55.513602 IP (tos 0xc0, ttl 1, id 35347, offset 0, flags [none], proto IGMP (2), length 32, options (RA))
    ae3--2888.uwar-atg-1.infra.washington.edu > 224.0.0.252: igmp query v2 [max resp time 10] [gaddr 224.0.0.252]
00:38:56.538187 IP (tos 0xc0, ttl 1, id 45028, offset 0, flags [none], proto IGMP (2), length 32, options (RA))
    ae3--2888.uwar-atg-1.infra.washington.edu > 224.0.0.252: igmp query v2 [max resp time 10] [gaddr 224.0.0.252]
00:38:57.152609 ARP, Ethernet (len 6), IPv4 (len 4), Request who-has d-69-91-148-164.dhcp4.washington.edu tell d-69-91-148-164.dhcp4.washington.edu, length 42
00:38:57.152808 ARP, Ethernet (len 6), IPv4 (len 4), Request who-has d-69-91-177-224.dhcp4.washington.edu tell d-69-91-177-224.dhcp4.washington.edu, length 46
00:38:57.173729 IP (tos 0x0, ttl 255, id 42062, offset 0, flags [none], proto UDP (17), length 72)
    d-69-91-181-31.dhcp4.washington.edu.53340 > dns1.cac.washington.edu.domain: 65288+ PTR? 164.148.91.69.in-addr.arpa. (44)
00:38:57.177434 IP (tos 0x0, ttl 59, id 194, offset 0, flags [none], proto UDP (17), length 270)
    dns1.cac.washington.edu.domain > d-69-91-181-31.dhcp4.washington.edu.53340: 65288* 1/3/4 164.148.91.69.in-addr.arpa. PTR D-69-91-148-164.dhcp4.washington.edu. (242)
00:38:57.357524 IP (tos 0xc0, ttl 1, id 52621, offset 0, flags [none], proto IGMP (2), length 32, options (RA))
    ae3--2888.uwar-atg-1.infra.washington.edu > 224.0.0.252: igmp query v2 [max resp time 10] [gaddr 224.0.0.252]
00:38:57.767075 IP (tos 0xc0, ttl 1, id 56636, offset 0, flags [none], proto IGMP (2), length 32, options (RA))
    ae3--2888.uwar-atg-1.infra.washington.edu > 224.0.0.252: igmp query v2 [max resp time 10] [gaddr 224.0.0.252]
00:38:57.767079 IP (tos 0xc0, ttl 1, id 56671, offset 0, flags [none], proto IGMP (2), length 32, options (RA))
    ae3--2888.uwar-atg-1.infra.washington.edu > 224.0.0.252: igmp query v2 [max resp time 10] [gaddr 224.0.0.252]
00:38:57.869510 IP (tos 0xc0, ttl 1, id 57146, offset 0, flags [none], proto IGMP (2), length 32, options (RA))
    ae3--2888.uwar-atg-1.infra.washington.edu > 224.0.0.252: igmp query v2 [max resp time 10] [gaddr 224.0.0.252]
00:38:58.586183 ARP, Ethernet (len 6), IPv4 (len 4), Request who-has d-69-91-148-164.dhcp4.washington.edu tell d-69-91-148-164.dhcp4.washington.edu, length 42
00:38:58.688690 IP (tos 0xc0, ttl 1, id 65400, offset 0, flags [none], proto IGMP (2), length 32, options (RA))
    ae3--2888.uwar-atg-1.infra.washington.edu > 224.0.0.252: igmp query v2 [max resp time 10] [gaddr 224.0.0.252]
00:38:59.508858 IP (tos 0xc0, ttl 1, id 7356, offset 0, flags [none], proto IGMP (2), length 32, options (RA))
    ae3--2888.uwar-atg-1.infra.washington.edu > 224.0.0.113: igmp query v2 [max resp time 10] [gaddr 224.0.0.113]
00:38:59.712577 IP (tos 0xc0, ttl 1, id 9238, offset 0, flags [none], proto IGMP (2), length 32, options (RA))
    ae3--2888.uwar-atg-1.infra.washington.edu > 224.0.0.252: igmp query v2 [max resp time 10] [gaddr 224.0.0.252]
00:38:59.712905 IP (tos 0xc0, ttl 1, id 9860, offset 0, flags [none], proto IGMP (2), length 32, options (RA))
    ae3--2888.uwar-atg-1.infra.washington.edu > 224.0.0.252: igmp query v2 [max resp time 10] [gaddr 224.0.0.252]
00:38:59.917518 ARP, Ethernet (len 6), IPv4 (len 4), Request who-has d-69-91-130-230.dhcp4.washington.edu tell d-69-91-130-230.dhcp4.washington.edu, length 42
00:39:00.122456 IP (tos 0xc0, ttl 1, id 13891, offset 0, flags [none], proto IGMP (2), length 32, options (RA))
    ae3--2888.uwar-atg-1.infra.washington.edu > 224.0.0.252: igmp query v2 [max resp time 10] [gaddr 224.0.0.252]
00:39:00.224721 ARP, Ethernet (len 6), IPv4 (len 4), Request who-has d-108-179-179-116.dhcp4.washington.edu tell d-108-179-179-116.dhcp4.washington.edu, length 46
00:39:00.531861 IP (tos 0xc0, ttl 1, id 17053, offset 0, flags [none], proto IGMP (2), length 32, options (RA))
    ae3--2888.uwar-atg-1.infra.washington.edu > 224.0.0.113: igmp query v2 [max resp time 10] [gaddr 224.0.0.113]
00:39:00.941564 ARP, Ethernet (len 6), IPv4 (len 4), Request who-has d-69-91-177-44.dhcp4.washington.edu tell d-69-91-177-44.dhcp4.washington.edu, length 42
00:39:00.941658 IP (tos 0xc0, ttl 1, id 21769, offset 0, flags [none], proto IGMP (2), length 32, options (RA))
    ae3--2888.uwar-atg-1.infra.washington.edu > 224.0.0.252: igmp query v2 [max resp time 10] [gaddr 224.0.0.252]
00:39:01.183622 IP (tos 0x0, ttl 255, id 18364, offset 0, flags [none], proto UDP (17), length 71)
    d-69-91-181-31.dhcp4.washington.edu.52141 > dns1.cac.washington.edu.domain: 32101+ PTR? 44.177.91.69.in-addr.arpa. (43)
00:39:01.188356 IP (tos 0x0, ttl 59, id 195, offset 0, flags [none], proto UDP (17), length 268)
    dns1.cac.washington.edu.domain > d-69-91-181-31.dhcp4.washington.edu.52141: 32101* 1/3/4 44.177.91.69.in-addr.arpa. PTR D-69-91-177-44.dhcp4.washington.edu. (240)
00:39:01.453468 IP (tos 0xc0, ttl 1, id 28085, offset 0, flags [none], proto IGMP (2), length 32, options (RA))
    ae3--2888.uwar-atg-1.infra.washington.edu > 224.0.0.252: igmp query v2 [max resp time 10] [gaddr 224.0.0.252]
00:39:02.477454 IP (tos 0xc0, ttl 1, id 40002, offset 0, flags [none], proto IGMP (2), length 32, options (RA))
    ae3--2888.uwar-atg-1.infra.washington.edu > 224.0.0.252: igmp query v2 [max resp time 10] [gaddr 224.0.0.252]
00:39:02.534156 ARP, Ethernet (len 6), IPv4 (len 4), Request who-has ae3--2888.uwar-atg-1.infra.washington.edu (00:00:5e:00:01:05 (oui Unknown)) tell d-69-91-181-31.dhcp4.washington.edu, length 28
00:39:02.537411 ARP, Ethernet (len 6), IPv4 (len 4), Reply ae3--2888.uwar-atg-1.infra.washington.edu is-at 00:00:5e:00:01:05 (oui Unknown), length 42
00:39:02.537455 IP (tos 0x0, ttl 64, id 28817, offset 0, flags [none], proto UDP (17), length 62)
    d-69-91-181-31.dhcp4.washington.edu.39412 > dns1.cac.washington.edu.domain: 26972+ A? www.facebook.com. (34)
00:39:02.539262 IP (tos 0x0, ttl 59, id 196, offset 0, flags [none], proto UDP (17), length 169)
    dns1.cac.washington.edu.domain > d-69-91-181-31.dhcp4.washington.edu.39412: 26972 2/2/2 www.facebook.com. CNAME star.c10r.facebook.com., star.c10r.facebook.com. A 31.13.75.17 (141)
00:39:02.539564 IP (tos 0x0, ttl 64, id 35884, offset 0, flags [DF], proto TCP (6), length 64)
    d-69-91-181-31.dhcp4.washington.edu.54463 > edge-star-shv-02-pao1.facebook.com.https: Flags [S], cksum 0xdc9a (correct), seq 3010967175, win 65535, options [mss 1460,nop,wscale 4,nop,nop,TS val 205236501 ecr 0,sackOK,eol], length 0
00:39:02.559566 IP (tos 0x0, ttl 86, id 0, offset 0, flags [DF], proto TCP (6), length 60)
    edge-star-shv-02-pao1.facebook.com.https > d-69-91-181-31.dhcp4.washington.edu.54463: Flags [S.], cksum 0x1145 (correct), seq 4041827247, ack 3010967176, win 14480, options [mss 1386,sackOK,TS val 2520496426 ecr 205236501,nop,wscale 8], length 0
00:39:02.559691 IP (tos 0x0, ttl 64, id 27325, offset 0, flags [DF], proto TCP (6), length 52)
    d-69-91-181-31.dhcp4.washington.edu.54463 > edge-star-shv-02-pao1.facebook.com.https: Flags [.], cksum 0x5810 (correct), ack 1, win 8244, options [nop,nop,TS val 205236521 ecr 2520496426], length 0
00:39:02.560004 IP (tos 0x0, ttl 64, id 39383, offset 0, flags [DF], proto TCP (6), length 268)
    d-69-91-181-31.dhcp4.washington.edu.54463 > edge-star-shv-02-pao1.facebook.com.https: Flags [P.], cksum 0x20d3 (correct), seq 1:217, ack 1, win 8244, options [nop,nop,TS val 205236521 ecr 2520496426], length 216
00:39:02.580023 IP (tos 0x0, ttl 86, id 55950, offset 0, flags [DF], proto TCP (6), length 52)
    edge-star-shv-02-pao1.facebook.com.https > d-69-91-181-31.dhcp4.washington.edu.54463: Flags [.], cksum 0x771b (correct), ack 217, win 61, options [nop,nop,TS val 2520496446 ecr 205236521], length 0
00:39:02.581122 IP (tos 0x0, ttl 86, id 55951, offset 0, flags [DF], proto TCP (6), length 1426)
    edge-star-shv-02-pao1.facebook.com.https > d-69-91-181-31.dhcp4.washington.edu.54463: Flags [.], cksum 0x886c (correct), seq 1:1375, ack 217, win 61, options [nop,nop,TS val 2520496447 ecr 205236521], length 1374
00:39:02.582584 IP (tos 0x0, ttl 86, id 55952, offset 0, flags [DF], proto TCP (6), length 1426)
    edge-star-shv-02-pao1.facebook.com.https > d-69-91-181-31.dhcp4.washington.edu.54463: Flags [.], cksum 0x48e7 (correct), seq 1375:2749, ack 217, win 61, options [nop,nop,TS val 2520496447 ecr 205236521], length 1374
00:39:02.582588 IP (tos 0x0, ttl 86, id 55953, offset 0, flags [DF], proto TCP (6), length 401)
    edge-star-shv-02-pao1.facebook.com.https > d-69-91-181-31.dhcp4.washington.edu.54463: Flags [P.], cksum 0xa736 (correct), seq 2749:3098, ack 217, win 61, options [nop,nop,TS val 2520496447 ecr 205236521], length 349
00:39:02.582657 IP (tos 0x0, ttl 64, id 4219, offset 0, flags [DF], proto TCP (6), length 52)
    d-69-91-181-31.dhcp4.washington.edu.54463 > edge-star-shv-02-pao1.facebook.com.https: Flags [.], cksum 0x4cdb (correct), ack 2749, win 8106, options [nop,nop,TS val 205236543 ecr 2520496447], length 0
00:39:02.582657 IP (tos 0x0, ttl 64, id 52077, offset 0, flags [DF], proto TCP (6), length 52)
    d-69-91-181-31.dhcp4.washington.edu.54463 > edge-star-shv-02-pao1.facebook.com.https: Flags [.], cksum 0x4b94 (correct), ack 3098, win 8084, options [nop,nop,TS val 205236543 ecr 2520496447], length 0
00:39:02.588369 IP (tos 0x0, ttl 64, id 23621, offset 0, flags [DF], proto TCP (6), length 214)
    d-69-91-181-31.dhcp4.washington.edu.54463 > edge-star-shv-02-pao1.facebook.com.https: Flags [P.], cksum 0x72f6 (correct), seq 217:379, ack 3098, win 8192, options [nop,nop,TS val 205236548 ecr 2520496447], length 162
00:39:02.588649 IP (tos 0x0, ttl 64, id 30830, offset 0, flags [DF], proto TCP (6), length 109)
    d-69-91-181-31.dhcp4.washington.edu.54463 > edge-star-shv-02-pao1.facebook.com.https: Flags [P.], cksum 0x8fdf (correct), seq 379:436, ack 3098, win 8192, options [nop,nop,TS val 205236548 ecr 2520496447], length 57
00:39:02.588710 IP (tos 0x0, ttl 64, id 24208, offset 0, flags [DF], proto TCP (6), length 97)
    d-69-91-181-31.dhcp4.washington.edu.54463 > edge-star-shv-02-pao1.facebook.com.https: Flags [P.], cksum 0x38b6 (correct), seq 436:481, ack 3098, win 8192, options [nop,nop,TS val 205236548 ecr 2520496447], length 45
00:39:02.589382 IP (tos 0x0, ttl 64, id 8388, offset 0, flags [DF], proto TCP (6), length 1063)
    d-69-91-181-31.dhcp4.washington.edu.54463 > edge-star-shv-02-pao1.facebook.com.https: Flags [P.], cksum 0x4b18 (correct), seq 481:1492, ack 3098, win 8192, options [nop,nop,TS val 205236548 ecr 2520496447], length 1011
00:39:02.589431 IP (tos 0x0, ttl 64, id 2066, offset 0, flags [DF], proto TCP (6), length 1426)
    d-69-91-181-31.dhcp4.washington.edu.54463 > edge-star-shv-02-pao1.facebook.com.https: Flags [.], cksum 0xeec1 (correct), seq 1492:2866, ack 3098, win 8192, options [nop,nop,TS val 205236549 ecr 2520496447], length 1374
00:39:02.589432 IP (tos 0x0, ttl 64, id 44133, offset 0, flags [DF], proto TCP (6), length 423)
    d-69-91-181-31.dhcp4.washington.edu.54463 > edge-star-shv-02-pao1.facebook.com.https: Flags [P.], cksum 0xfcc0 (correct), seq 2866:3237, ack 3098, win 8192, options [nop,nop,TS val 205236549 ecr 2520496447], length 371
00:39:02.609469 IP (tos 0x0, ttl 86, id 55954, offset 0, flags [DF], proto TCP (6), length 52)
    edge-star-shv-02-pao1.facebook.com.https > d-69-91-181-31.dhcp4.washington.edu.54463: Flags [.], cksum 0x65c2 (correct), ack 1492, win 73, options [nop,nop,TS val 2520496476 ecr 205236548], length 0
00:39:02.609544 IP (tos 0x0, ttl 86, id 55955, offset 0, flags [DF], proto TCP (6), length 310)
    edge-star-shv-02-pao1.facebook.com.https > d-69-91-181-31.dhcp4.washington.edu.54463: Flags [P.], cksum 0x8885 (correct), seq 3098:3356, ack 1492, win 73, options [nop,nop,TS val 2520496476 ecr 205236548], length 258
00:39:02.609638 IP (tos 0x0, ttl 64, id 37052, offset 0, flags [DF], proto TCP (6), length 52)
    d-69-91-181-31.dhcp4.washington.edu.54463 > edge-star-shv-02-pao1.facebook.com.https: Flags [.], cksum 0x3e34 (correct), ack 3356, win 8175, options [nop,nop,TS val 205236569 ecr 2520496476], length 0
00:39:02.609816 IP (tos 0x0, ttl 86, id 55956, offset 0, flags [DF], proto TCP (6), length 125)
    edge-star-shv-02-pao1.facebook.com.https > d-69-91-181-31.dhcp4.washington.edu.54463: Flags [P.], cksum 0xce13 (correct), seq 3356:3429, ack 1492, win 73, options [nop,nop,TS val 2520496476 ecr 205236548], length 73
00:39:02.609850 IP (tos 0x0, ttl 64, id 45955, offset 0, flags [DF], proto TCP (6), length 52)
    d-69-91-181-31.dhcp4.washington.edu.54463 > edge-star-shv-02-pao1.facebook.com.https: Flags [.], cksum 0x3ddf (correct), ack 3429, win 8187, options [nop,nop,TS val 205236569 ecr 2520496476], length 0
00:39:02.610179 IP (tos 0x0, ttl 86, id 55957, offset 0, flags [DF], proto TCP (6), length 52)
    edge-star-shv-02-pao1.facebook.com.https > d-69-91-181-31.dhcp4.washington.edu.54463: Flags [.], cksum 0x5d8f (correct), ack 3237, win 95, options [nop,nop,TS val 2520496476 ecr 205236549], length 0
00:39:02.610840 IP (tos 0x0, ttl 86, id 55958, offset 0, flags [DF], proto TCP (6), length 97)
    edge-star-shv-02-pao1.facebook.com.https > d-69-91-181-31.dhcp4.washington.edu.54463: Flags [P.], cksum 0xa9af (correct), seq 3429:3474, ack 3237, win 95, options [nop,nop,TS val 2520496476 ecr 205236549], length 45
00:39:02.610908 IP (tos 0x0, ttl 64, id 52661, offset 0, flags [DF], proto TCP (6), length 52)
    d-69-91-181-31.dhcp4.washington.edu.54463 > edge-star-shv-02-pao1.facebook.com.https: Flags [.], cksum 0x3daf (correct), ack 3474, win 8189, options [nop,nop,TS val 205236570 ecr 2520496476], length 0
00:39:02.754626 IP (tos 0x0, ttl 86, id 55960, offset 0, flags [DF], proto TCP (6), length 302)
    edge-star-shv-02-pao1.facebook.com.https > d-69-91-181-31.dhcp4.washington.edu.54463: Flags [P.], cksum 0x0067 (correct), seq 4848:5098, ack 3237, win 95, options [nop,nop,TS val 2520496619 ecr 205236570], length 250
00:39:02.754740 IP (tos 0x0, ttl 64, id 41156, offset 0, flags [DF], proto TCP (6), length 64)
    d-69-91-181-31.dhcp4.washington.edu.54463 > edge-star-shv-02-pao1.facebook.com.https: Flags [.], cksum 0x36fa (correct), ack 3474, win 8192, options [nop,nop,TS val 205236712 ecr 2520496476,nop,nop,sack 1 {4848:5098}], length 0
00:39:02.755642 IP (tos 0x0, ttl 86, id 55961, offset 0, flags [DF], proto TCP (6), length 1426)
    edge-star-shv-02-pao1.facebook.com.https > d-69-91-181-31.dhcp4.washington.edu.54463: Flags [.], cksum 0x92ed (correct), seq 5098:6472, ack 3237, win 95, options [nop,nop,TS val 2520496619 ecr 205236570], length 1374
00:39:02.755646 IP (tos 0x0, ttl 86, id 55962, offset 0, flags [DF], proto TCP (6), length 1316)
    edge-star-shv-02-pao1.facebook.com.https > d-69-91-181-31.dhcp4.washington.edu.54463: Flags [P.], cksum 0xb334 (correct), seq 6472:7736, ack 3237, win 95, options [nop,nop,TS val 2520496619 ecr 205236570], length 1264
00:39:02.755647 IP (tos 0x0, ttl 86, id 55963, offset 0, flags [DF], proto TCP (6), length 1404)
    edge-star-shv-02-pao1.facebook.com.https > d-69-91-181-31.dhcp4.washington.edu.54463: Flags [P.], cksum 0x4d7f (correct), seq 7736:9088, ack 3237, win 95, options [nop,nop,TS val 2520496619 ecr 205236570], length 1352
00:39:02.755648 IP (tos 0x0, ttl 86, id 55964, offset 0, flags [DF], proto TCP (6), length 953)
    edge-star-shv-02-pao1.facebook.com.https > d-69-91-181-31.dhcp4.washington.edu.54463: Flags [P.], cksum 0x5285 (correct), seq 9088:9989, ack 3237, win 95, options [nop,nop,TS val 2520496619 ecr 205236570], length 901
00:39:02.755763 IP (tos 0x0, ttl 64, id 12746, offset 0, flags [DF], proto TCP (6), length 64)
    d-69-91-181-31.dhcp4.washington.edu.54463 > edge-star-shv-02-pao1.facebook.com.https: Flags [.], cksum 0x319b (correct), ack 3474, win 8192, options [nop,nop,TS val 205236713 ecr 2520496476,nop,nop,sack 1 {4848:6472}], length 0
00:39:02.755764 IP (tos 0x0, ttl 64, id 27230, offset 0, flags [DF], proto TCP (6), length 64)
    d-69-91-181-31.dhcp4.washington.edu.54463 > edge-star-shv-02-pao1.facebook.com.https: Flags [.], cksum 0x2cab (correct), ack 3474, win 8192, options [nop,nop,TS val 205236713 ecr 2520496476,nop,nop,sack 1 {4848:7736}], length 0
00:39:02.755764 IP (tos 0x0, ttl 64, id 44935, offset 0, flags [DF], proto TCP (6), length 64)
    d-69-91-181-31.dhcp4.washington.edu.54463 > edge-star-shv-02-pao1.facebook.com.https: Flags [.], cksum 0x2763 (correct), ack 3474, win 8192, options [nop,nop,TS val 205236713 ecr 2520496476,nop,nop,sack 1 {4848:9088}], length 0
00:39:02.755765 IP (tos 0x0, ttl 64, id 56830, offset 0, flags [DF], proto TCP (6), length 64)
    d-69-91-181-31.dhcp4.washington.edu.54463 > edge-star-shv-02-pao1.facebook.com.https: Flags [.], cksum 0x23de (correct), ack 3474, win 8192, options [nop,nop,TS val 205236713 ecr 2520496476,nop,nop,sack 1 {4848:9989}], length 0
00:39:02.991444 IP (tos 0x0, ttl 86, id 55965, offset 0, flags [DF], proto TCP (6), length 1426)
    edge-star-shv-02-pao1.facebook.com.https > d-69-91-181-31.dhcp4.washington.edu.54463: Flags [.], cksum 0x8a76 (correct), seq 3474:4848, ack 3237, win 95, options [nop,nop,TS val 2520496839 ecr 205236713], length 1374
00:39:02.991569 IP (tos 0x0, ttl 64, id 18486, offset 0, flags [DF], proto TCP (6), length 52)
    d-69-91-181-31.dhcp4.washington.edu.54463 > edge-star-shv-02-pao1.facebook.com.https: Flags [.], cksum 0x22ec (correct), ack 9989, win 7784, options [nop,nop,TS val 205236948 ecr 2520496839], length 0
00:39:02.991684 IP (tos 0x0, ttl 64, id 14582, offset 0, flags [DF], proto TCP (6), length 52)
    d-69-91-181-31.dhcp4.washington.edu.54463 > edge-star-shv-02-pao1.facebook.com.https: Flags [.], cksum 0x2154 (correct), ack 9989, win 8192, options [nop,nop,TS val 205236948 ecr 2520496839], length 0
00:39:03.191723 IP (tos 0x0, ttl 255, id 10519, offset 0, flags [none], proto UDP (17), length 70)
    d-69-91-181-31.dhcp4.washington.edu.59188 > dns1.cac.washington.edu.domain: 46279+ PTR? 17.75.13.31.in-addr.arpa. (42)
00:39:03.195023 IP (tos 0x0, ttl 59, id 197, offset 0, flags [none], proto UDP (17), length 287)
    dns1.cac.washington.edu.domain > d-69-91-181-31.dhcp4.washington.edu.59188: 46279 1/5/5 17.75.13.31.in-addr.arpa. PTR edge-star-shv-02-pao1.facebook.com. (259)
00:39:05.139821 IP (tos 0xc0, ttl 1, id 1510, offset 0, flags [none], proto IGMP (2), length 32, options (RA))
    ae3--2888.uwar-atg-1.infra.washington.edu > 224.0.0.252: igmp query v2 [max resp time 10] [gaddr 224.0.0.252]
00:39:05.140042 IP (tos 0xc0, ttl 1, id 1857, offset 0, flags [none], proto IGMP (2), length 32, options (RA))
    ae3--2888.uwar-atg-1.infra.washington.edu > 224.0.0.252: igmp query v2 [max resp time 10] [gaddr 224.0.0.252]
00:39:05.448702 IP (tos 0x0, ttl 52, id 38394, offset 0, flags [DF], proto TCP (6), length 137)
    live.github.com.https > d-69-91-181-31.dhcp4.washington.edu.54412: Flags [P.], cksum 0x412c (correct), seq 60550882:60550967, ack 1951318615, win 17, options [nop,nop,TS val 943051052 ecr 205179365], length 85
00:39:05.448706 IP (tos 0x0, ttl 52, id 30163, offset 0, flags [DF], proto TCP (6), length 121)
    live.github.com.https > d-69-91-181-31.dhcp4.washington.edu.54415: Flags [P.], cksum 0x5adf (correct), seq 3511766894:3511766963, ack 494000317, win 17, options [nop,nop,TS val 943051063 ecr 205179381], length 69
00:39:05.448778 IP (tos 0x0, ttl 64, id 8903, offset 0, flags [DF], proto TCP (6), length 52)
    d-69-91-181-31.dhcp4.washington.edu.54412 > live.github.com.https: Flags [.], cksum 0xd60d (correct), ack 85, win 8186, options [nop,nop,TS val 205239399 ecr 943051052], length 0
00:39:05.448779 IP (tos 0x0, ttl 64, id 33842, offset 0, flags [DF], proto TCP (6), length 52)
    d-69-91-181-31.dhcp4.washington.edu.54415 > live.github.com.https: Flags [.], cksum 0xe843 (correct), ack 69, win 8187, options [nop,nop,TS val 205239399 ecr 943051063], length 0
00:39:05.449883 IP (tos 0x0, ttl 52, id 30164, offset 0, flags [DF], proto TCP (6), length 121)
    live.github.com.https > d-69-91-181-31.dhcp4.washington.edu.54415: Flags [P.], cksum 0xdce9 (correct), seq 69:138, ack 1, win 17, options [nop,nop,TS val 943051063 ecr 205179381], length 69
00:39:05.449935 IP (tos 0x0, ttl 64, id 10808, offset 0, flags [DF], proto TCP (6), length 52)
