00:31:00.223968 IP ae3--2888.uwar-atg-1.infra.washington.edu > 224.0.0.252: igmp query v2 [max resp time 10] [gaddr 224.0.0.252]
00:31:03.088712 IP ae3--2888.uwar-atg-1.infra.washington.edu > 224.0.0.252: igmp query v2 [max resp time 10] [gaddr 224.0.0.252]
00:31:03.293414 ARP, Request who-has d-69-91-148-251.dhcp4.washington.edu tell d-69-91-148-251.dhcp4.washington.edu, length 42
00:31:03.638376 IP d-69-91-181-31.dhcp4.washington.edu.55746 > dns1.cac.washington.edu.domain: 2521+ PTR? 251.148.91.69.in-addr.arpa. (44)
00:31:03.641042 IP dns1.cac.washington.edu.domain > d-69-91-181-31.dhcp4.washington.edu.55746: 2521* 1/3/4 PTR D-69-91-148-251.dhcp4.washington.edu. (242)
00:31:03.828216 IP channel-proxy-shv-04-frc3.facebook.com.https > d-69-91-181-31.dhcp4.washington.edu.54403: Flags [.], seq 3117251774:3117251810, ack 3624447815, win 106, options [nop,nop,TS val 1695267328 ecr 204517612], length 36
00:31:03.828345 IP d-69-91-181-31.dhcp4.washington.edu.54403 > channel-proxy-shv-04-frc3.facebook.com.https: Flags [R], seq 3624447815, win 0, length 0
00:31:04.447368 IP d-69-91-181-31.dhcp4.washington.edu.54446 > ec2-54-235-115-69.compute-1.amazonaws.com.https: Flags [P.], seq 600067145:600067214, ack 3261892735, win 8192, options [nop,nop,TS val 204758977 ecr 1216210433], length 69
00:31:04.447502 IP d-69-91-181-31.dhcp4.washington.edu.54446 > ec2-54-235-115-69.compute-1.amazonaws.com.https: Flags [F.], seq 69, ack 1, win 8192, options [nop,nop,TS val 204758977 ecr 1216210433], length 0
00:31:04.516230 IP ec2-54-235-115-69.compute-1.amazonaws.com.https > d-69-91-181-31.dhcp4.washington.edu.54446: Flags [P.], seq 1:70, ack 70, win 80, options [nop,nop,TS val 1216223916 ecr 204758977], length 69
00:31:04.516234 IP ec2-54-235-115-69.compute-1.amazonaws.com.https > d-69-91-181-31.dhcp4.washington.edu.54446: Flags [F.], seq 70, ack 70, win 80, options [nop,nop,TS val 1216223917 ecr 204758977], length 0
00:31:04.516298 IP d-69-91-181-31.dhcp4.washington.edu.54446 > ec2-54-235-115-69.compute-1.amazonaws.com.https: Flags [R], seq 600067215, win 0, length 0
00:31:04.516298 IP d-69-91-181-31.dhcp4.washington.edu.54446 > ec2-54-235-115-69.compute-1.amazonaws.com.https: Flags [R], seq 600067215, win 0, length 0
00:31:04.644121 IP d-69-91-181-31.dhcp4.washington.edu.61369 > dns1.cac.washington.edu.domain: 39597+ PTR? 16.107.252.173.in-addr.arpa. (45)
00:31:04.646019 IP dns1.cac.washington.edu.domain > d-69-91-181-31.dhcp4.washington.edu.61369: 39597 1/2/2 PTR channel-proxy-shv-04-frc3.facebook.com. (164)
00:31:04.647479 IP d-69-91-181-31.dhcp4.washington.edu.49513 > dns1.cac.washington.edu.domain: 39731+ PTR? 69.115.235.54.in-addr.arpa. (44)
00:31:04.652639 IP dns1.cac.washington.edu.domain > d-69-91-181-31.dhcp4.washington.edu.49513: 39731 1/5/4 PTR ec2-54-235-115-69.compute-1.amazonaws.com. (288)
00:31:04.727006 ARP, Request who-has d-69-91-148-251.dhcp4.washington.edu tell d-69-91-148-251.dhcp4.washington.edu, length 42
00:31:04.928598 IP live.github.com.https > d-69-91-181-31.dhcp4.washington.edu.54413: Flags [P.], seq 1032749059:1032749144, ack 2378476756, win 17, options [nop,nop,TS val 942930946 ecr 204699725], length 85
00:31:04.928715 IP d-69-91-181-31.dhcp4.washington.edu.54413 > live.github.com.https: Flags [.], ack 85, win 8186, options [nop,nop,TS val 204759455 ecr 942930946], length 0
00:31:04.932529 IP live.github.com.https > d-69-91-181-31.dhcp4.washington.edu.54415: Flags [P.], seq 3511766108:3511766193, ack 494000317, win 17, options [nop,nop,TS val 942930947 ecr 204699725], length 85
00:31:04.932606 IP d-69-91-181-31.dhcp4.washington.edu.54415 > live.github.com.https: Flags [.], ack 85, win 8186, options [nop,nop,TS val 204759458 ecr 942930947], length 0
00:31:04.933950 IP live.github.com.https > d-69-91-181-31.dhcp4.washington.edu.54412: Flags [P.], seq 60550149:60550218, ack 1951318615, win 17, options [nop,nop,TS val 942930946 ecr 204699766], length 69
00:31:04.933953 IP live.github.com.https > d-69-91-181-31.dhcp4.washington.edu.54412: Flags [P.], seq 69:138, ack 1, win 17, options [nop,nop,TS val 942930946 ecr 204699766], length 69
00:31:04.934003 IP d-69-91-181-31.dhcp4.washington.edu.54412 > live.github.com.https: Flags [.], ack 69, win 8187, options [nop,nop,TS val 204759459 ecr 942930946], length 0
00:31:04.934003 IP d-69-91-181-31.dhcp4.washington.edu.54412 > live.github.com.https: Flags [.], ack 138, win 8183, options [nop,nop,TS val 204759459 ecr 942930946], length 0
00:31:04.989217 IP live.github.com.https > d-69-91-181-31.dhcp4.washington.edu.54414: Flags [P.], seq 3613588083:3613588168, ack 4091564222, win 17, options [nop,nop,TS val 942930961 ecr 204699516], length 85
00:31:04.989304 IP d-69-91-181-31.dhcp4.washington.edu.54414 > live.github.com.https: Flags [.], ack 85, win 8186, options [nop,nop,TS val 204759513 ecr 942930961], length 0
00:31:05.654874 IP d-69-91-181-31.dhcp4.washington.edu.51864 > dns1.cac.washington.edu.domain: 3898+ PTR? 86.252.30.192.in-addr.arpa. (44)
00:31:05.676240 IP dns1.cac.washington.edu.domain > d-69-91-181-31.dhcp4.washington.edu.51864: 3898 1/4/5 PTR live.github.com. (263)
00:31:05.853542 IP ae3--2888.uwar-atg-1.infra.washington.edu > 224.0.0.252: igmp query v2 [max resp time 10] [gaddr 224.0.0.252]
00:31:05.853903 IP ae3--2888.uwar-atg-1.infra.washington.edu > 224.0.0.252: igmp query v2 [max resp time 10] [gaddr 224.0.0.252]
00:31:06.878264 IP ae3--2888.uwar-atg-1.infra.washington.edu > 224.0.0.252: igmp query v2 [max resp time 10] [gaddr 224.0.0.252]
00:31:07.492528 IP ae3--2888.uwar-atg-1.infra.washington.edu > 224.0.0.252: igmp query v2 [max resp time 10] [gaddr 224.0.0.252]
00:31:07.492801 IP ae3--2888.uwar-atg-1.infra.washington.edu > 224.0.0.252: igmp query v2 [max resp time 10] [gaddr 224.0.0.252]
00:31:08.108194 IP 192.30.252.89.https > d-69-91-181-31.dhcp4.washington.edu.54376: Flags [P.], seq 3560382511:3560382596, ack 672204346, win 17, options [nop,nop,TS val 53272832 ecr 204511570], length 85
00:31:08.108269 IP d-69-91-181-31.dhcp4.washington.edu.54376 > 192.30.252.89.https: Flags [R], seq 672204346, win 0, length 0
00:31:08.414177 IP ae3--2888.uwar-atg-1.infra.washington.edu > 224.0.0.252: igmp query v2 [max resp time 10] [gaddr 224.0.0.252]
00:31:08.679622 IP d-69-91-181-31.dhcp4.washington.edu.50150 > dns1.cac.washington.edu.domain: 3834+ PTR? 89.252.30.192.in-addr.arpa. (44)
00:31:08.691196 IP dns1.cac.washington.edu.domain > d-69-91-181-31.dhcp4.washington.edu.50150: 3834 NXDomain 0/1/0 (112)
00:31:09.852917 IP ae3--2888.uwar-atg-1.infra.washington.edu > 224.0.0.252: igmp query v2 [max resp time 10] [gaddr 224.0.0.252]
00:31:10.155475 IP ae3--2888.uwar-atg-1.infra.washington.edu > 224.0.0.252: igmp query v2 [max resp time 10] [gaddr 224.0.0.252]
00:31:10.155867 IP ae3--2888.uwar-atg-1.infra.washington.edu > 224.0.0.252: igmp query v2 [max resp time 10] [gaddr 224.0.0.252]
00:31:10.567236 IP ae3--2888.uwar-atg-1.infra.washington.edu > 224.0.0.252: igmp query v2 [max resp time 10] [gaddr 224.0.0.252]
00:31:11.076551 IP ae3--2888.uwar-atg-1.infra.washington.edu > 224.0.0.252: igmp query v2 [max resp time 10] [gaddr 224.0.0.252]
00:31:11.179634 IP ae3--2888.uwar-atg-1.infra.washington.edu > 224.0.0.252: igmp query v2 [max resp time 10] [gaddr 224.0.0.252]
00:31:12.100429 IP ae3--2888.uwar-atg-1.infra.washington.edu > 224.0.0.252: igmp query v2 [max resp time 10] [gaddr 224.0.0.252]
00:31:12.510023 IP ae3--2888.uwar-atg-1.infra.washington.edu > 224.0.0.252: igmp query v2 [max resp time 10] [gaddr 224.0.0.252]
00:31:12.510572 IP ae3--2888.uwar-atg-1.infra.washington.edu > 224.0.0.252: igmp query v2 [max resp time 10] [gaddr 224.0.0.252]
00:31:12.714822 ARP, Request who-has d-69-91-148-67.dhcp4.washington.edu tell d-69-91-148-67.dhcp4.washington.edu, length 42
00:31:12.817266 ARP, Request who-has d-128-95-62-123.dhcp4.washington.edu tell d-128-95-62-123.dhcp4.washington.edu, length 42
00:31:13.534012 IP ae3--2888.uwar-atg-1.infra.washington.edu > 224.0.0.252: igmp query v2 [max resp time 10] [gaddr 224.0.0.252]

00:31:29.714564 IP (tos 0xc0, ttl 1, id 17631, offset 0, flags [none], proto IGMP (2), length 32, options (RA))
    ae3--2888.uwar-atg-1.infra.washington.edu > 224.0.0.252: igmp query v2 [max resp time 10] [gaddr 224.0.0.252]
00:31:30.636012 IP (tos 0xc0, ttl 1, id 34010, offset 0, flags [none], proto IGMP (2), length 32, options (RA))
    ae3--2888.uwar-atg-1.infra.washington.edu > 224.0.0.252: igmp query v2 [max resp time 10] [gaddr 224.0.0.252]
00:31:30.636070 IP (tos 0xc0, ttl 1, id 34906, offset 0, flags [none], proto IGMP (2), length 32, options (RA))
    ae3--2888.uwar-atg-1.infra.washington.edu > 224.0.0.252: igmp query v2 [max resp time 10] [gaddr 224.0.0.252]
00:31:30.943102 ARP, Ethernet (len 6), IPv4 (len 4), Request who-has d-173-250-177-131.dhcp4.washington.edu tell d-173-250-177-131.dhcp4.washington.edu, length 42
00:31:31.546468 ARP, Ethernet (len 6), IPv4 (len 4), Request who-has ae3--2888.uwar-atg-1.infra.washington.edu (00:00:5e:00:01:05 (oui Unknown)) tell d-69-91-181-31.dhcp4.washington.edu, length 28
00:31:31.548524 ARP, Ethernet (len 6), IPv4 (len 4), Reply ae3--2888.uwar-atg-1.infra.washington.edu is-at 00:00:5e:00:01:05 (oui Unknown), length 42
00:31:31.548568 IP (tos 0x0, ttl 255, id 45420, offset 0, flags [none], proto UDP (17), length 74)
    d-69-91-181-31.dhcp4.washington.edu.58071 > dns1.cac.washington.edu.domain: 36363+ PTR? 131.177.250.173.in-addr.arpa. (46)
00:31:31.550593 IP (tos 0x0, ttl 59, id 100, offset 0, flags [none], proto UDP (17), length 202)
    dns1.cac.washington.edu.domain > d-69-91-181-31.dhcp4.washington.edu.58071: 36363* 1/2/2 131.177.250.173.in-addr.arpa. PTR D-173-250-177-131.dhcp4.washington.edu. (174)
00:31:31.659895 IP (tos 0xc0, ttl 1, id 50724, offset 0, flags [none], proto IGMP (2), length 32, options (RA))
    ae3--2888.uwar-atg-1.infra.washington.edu > 224.0.0.252: igmp query v2 [max resp time 10] [gaddr 224.0.0.252]
00:31:33.912635 ARP, Ethernet (len 6), IPv4 (len 4), Request who-has d-69-91-179-254.dhcp4.washington.edu tell d-69-91-179-254.dhcp4.washington.edu, length 42
00:31:34.220102 IP (tos 0xc0, ttl 1, id 11830, offset 0, flags [none], proto IGMP (2), length 32, options (RA))
    ae3--2888.uwar-atg-1.infra.washington.edu > 224.0.0.252: igmp query v2 [max resp time 10] [gaddr 224.0.0.252]
00:31:34.220645 IP (tos 0xc0, ttl 1, id 11881, offset 0, flags [none], proto IGMP (2), length 32, options (RA))
    ae3--2888.uwar-atg-1.infra.washington.edu > 224.0.0.252: igmp query v2 [max resp time 10] [gaddr 224.0.0.252]
00:31:34.554811 IP (tos 0x0, ttl 255, id 35806, offset 0, flags [none], proto UDP (17), length 72)
    d-69-91-181-31.dhcp4.washington.edu.64266 > dns1.cac.washington.edu.domain: 1501+ PTR? 254.179.91.69.in-addr.arpa. (44)
00:31:34.557392 IP (tos 0x0, ttl 59, id 101, offset 0, flags [none], proto UDP (17), length 270)
    dns1.cac.washington.edu.domain > d-69-91-181-31.dhcp4.washington.edu.64266: 1501* 1/3/4 254.179.91.69.in-addr.arpa. PTR D-69-91-179-254.dhcp4.washington.edu. (242)
00:31:34.731939 IP (tos 0xc0, ttl 1, id 14735, offset 0, flags [none], proto IGMP (2), length 32, options (RA))
    ae3--2888.uwar-atg-1.infra.washington.edu > 224.0.0.252: igmp query v2 [max resp time 10] [gaddr 224.0.0.252]
00:31:34.834357 ARP, Ethernet (len 6), IPv4 (len 4), Request who-has d-69-91-177-203.dhcp4.washington.edu tell d-69-91-177-203.dhcp4.washington.edu, length 42
00:31:34.834360 ARP, Ethernet (len 6), IPv4 (len 4), Request who-has d-173-250-177-113.dhcp4.washington.edu tell d-173-250-177-113.dhcp4.washington.edu, length 46
00:31:35.558308 IP (tos 0x0, ttl 255, id 59791, offset 0, flags [none], proto UDP (17), length 72)
    d-69-91-181-31.dhcp4.washington.edu.57076 > dns1.cac.washington.edu.domain: 42915+ PTR? 203.177.91.69.in-addr.arpa. (44)
00:31:35.560657 IP (tos 0x0, ttl 59, id 102, offset 0, flags [none], proto UDP (17), length 270)
    dns1.cac.washington.edu.domain > d-69-91-181-31.dhcp4.washington.edu.57076: 42915* 1/3/4 203.177.91.69.in-addr.arpa. PTR D-69-91-177-203.dhcp4.washington.edu. (242)
00:31:35.561108 IP (tos 0x0, ttl 255, id 46059, offset 0, flags [none], proto UDP (17), length 74)
    d-69-91-181-31.dhcp4.washington.edu.57255 > dns1.cac.washington.edu.domain: 798+ PTR? 113.177.250.173.in-addr.arpa. (46)
00:31:35.562808 IP (tos 0x0, ttl 59, id 103, offset 0, flags [none], proto UDP (17), length 202)
    dns1.cac.washington.edu.domain > d-69-91-181-31.dhcp4.washington.edu.57255: 798* 1/2/2 113.177.250.173.in-addr.arpa. PTR D-173-250-177-113.dhcp4.washington.edu. (174)
00:31:35.755853 IP (tos 0xc0, ttl 1, id 20793, offset 0, flags [none], proto IGMP (2), length 32, options (RA))
    ae3--2888.uwar-atg-1.infra.washington.edu > 224.0.0.252: igmp query v2 [max resp time 10] [gaddr 224.0.0.252]
00:31:36.780603 ARP, Ethernet (len 6), IPv4 (len 4), Request who-has d-69-91-177-203.dhcp4.washington.edu tell d-69-91-177-203.dhcp4.washington.edu, length 42
00:31:37.804820 ARP, Ethernet (len 6), IPv4 (len 4), Request who-has d-108-179-145-198.dhcp4.washington.edu tell d-108-179-145-198.dhcp4.washington.edu, length 42
00:31:38.567578 IP (tos 0x0, ttl 255, id 4086, offset 0, flags [none], proto UDP (17), length 74)
    d-69-91-181-31.dhcp4.washington.edu.50083 > dns1.cac.washington.edu.domain: 45263+ PTR? 198.145.179.108.in-addr.arpa. (46)
00:31:38.570536 IP (tos 0x0, ttl 59, id 104, offset 0, flags [none], proto UDP (17), length 274)
    dns1.cac.washington.edu.domain > d-69-91-181-31.dhcp4.washington.edu.50083: 45263* 1/3/4 198.145.179.108.in-addr.arpa. PTR D-108-179-145-198.dhcp4.washington.edu. (246)
00:31:38.931221 IP (tos 0xc0, ttl 1, id 38562, offset 0, flags [none], proto IGMP (2), length 32, options (RA))
    ae3--2888.uwar-atg-1.infra.washington.edu > 224.0.0.113: igmp query v2 [max resp time 10] [gaddr 224.0.0.113]
00:31:39.571544 IP (tos 0x0, ttl 255, id 55562, offset 0, flags [none], proto UDP (17), length 70)
    d-69-91-181-31.dhcp4.washington.edu.64097 > dns1.cac.washington.edu.domain: 54884+ PTR? 113.0.0.224.in-addr.arpa. (42)
00:31:39.576712 IP (tos 0x0, ttl 59, id 105, offset 0, flags [none], proto UDP (17), length 127)
    dns1.cac.washington.edu.domain > d-69-91-181-31.dhcp4.washington.edu.64097: 54884 NXDomain 0/1/0 (99)
00:31:39.647808 IP (tos 0xc0, ttl 1, id 43020, offset 0, flags [none], proto IGMP (2), length 32, options (RA))
    ae3--2888.uwar-atg-1.infra.washington.edu > 224.0.0.252: igmp query v2 [max resp time 10] [gaddr 224.0.0.252]
00:31:39.852508 IP (tos 0xc0, ttl 1, id 43937, offset 0, flags [none], proto IGMP (2), length 32, options (RA))
    ae3--2888.uwar-atg-1.infra.washington.edu > 224.0.0.113: igmp query v2 [max resp time 10] [gaddr 224.0.0.113]
00:31:41.697667 ARP, Ethernet (len 6), IPv4 (len 4), Request who-has d-69-91-148-67.dhcp4.washington.edu tell d-69-91-148-67.dhcp4.washington.edu, length 42
00:31:41.901919 ARP, Ethernet (len 6), IPv4 (len 4), Request who-has d-173-250-177-131.dhcp4.washington.edu tell d-173-250-177-131.dhcp4.washington.edu, length 42
00:31:42.516575 IP (tos 0xc0, ttl 1, id 2311, offset 0, flags [none], proto IGMP (2), length 32, options (RA))
    ae3--2888.uwar-atg-1.infra.washington.edu > 224.0.0.252: igmp query v2 [max resp time 10] [gaddr 224.0.0.252]
00:31:42.617559 IP (tos 0xc0, ttl 1, id 4533, offset 0, flags [none], proto IGMP (2), length 32, options (RA))
    ae3--2888.uwar-atg-1.infra.washington.edu > 224.0.0.252: igmp query v2 [max resp time 10] [gaddr 224.0.0.252]
00:31:43.744082 ARP, Ethernet (len 6), IPv4 (len 4), Request who-has d-128-95-62-123.dhcp4.washington.edu tell d-128-95-62-123.dhcp4.washington.edu, length 42
00:31:45.177249 IP (tos 0xc0, ttl 1, id 31506, offset 0, flags [none], proto IGMP (2), length 32, options (RA))
    ae3--2888.uwar-atg-1.infra.washington.edu > 224.0.0.252: igmp query v2 [max resp time 10] [gaddr 224.0.0.252]
00:31:45.177733 IP (tos 0xc0, ttl 1, id 31511, offset 0, flags [none], proto IGMP (2), length 32, options (RA))
    ae3--2888.uwar-atg-1.infra.washington.edu > 224.0.0.252: igmp query v2 [max resp time 10] [gaddr 224.0.0.252]
00:31:45.791731 IP (tos 0xc0, ttl 1, id 38440, offset 0, flags [none], proto IGMP (2), length 32, options (RA))
    ae3--2888.uwar-atg-1.infra.washington.edu > 224.0.0.252: igmp query v2 [max resp time 10] [gaddr 224.0.0.252]
00:31:45.792292 IP (tos 0xc0, ttl 1, id 38977, offset 0, flags [none], proto IGMP (2), length 32, options (RA))
    ae3--2888.uwar-atg-1.infra.washington.edu > 224.0.0.252: igmp query v2 [max resp time 10] [gaddr 224.0.0.252]
00:31:46.736494 IP (tos 0x0, ttl 81, id 57797, offset 0, flags [DF], proto TCP (6), length 533)
    channel-proxy-shv-04-frc3.facebook.com.https > d-69-91-181-31.dhcp4.washington.edu.54443: Flags [P.], cksum 0xe2fe (correct), seq 3723720851:3723721332, ack 3713313198, win 136, options [nop,nop,TS val 1934280655 ecr 204751089], length 481
00:31:46.736553 ARP, Ethernet (len 6), IPv4 (len 4), Request who-has ae3--2888.uwar-atg-1.infra.washington.edu (00:00:5e:00:01:05 (oui Unknown)) tell d-69-91-181-31.dhcp4.washington.edu, length 28
00:31:46.738619 ARP, Ethernet (len 6), IPv4 (len 4), Reply ae3--2888.uwar-atg-1.infra.washington.edu is-at 00:00:5e:00:01:05 (oui Unknown), length 42
00:31:46.738657 IP (tos 0x0, ttl 64, id 27506, offset 0, flags [DF], proto TCP (6), length 52)
    d-69-91-181-31.dhcp4.washington.edu.54443 > channel-proxy-shv-04-frc3.facebook.com.https: Flags [.], cksum 0x4153 (correct), ack 481, win 8161, options [nop,nop,TS val 204801248 ecr 1934280655], length 0
00:31:46.742466 IP (tos 0x0, ttl 64, id 6822, offset 0, flags [DF], proto TCP (6), length 645)
    d-69-91-181-31.dhcp4.washington.edu.54443 > channel-proxy-shv-04-frc3.facebook.com.https: Flags [P.], cksum 0x594a (correct), seq 1:594, ack 481, win 8192, options [nop,nop,TS val 204801253 ecr 1934280655], length 593
00:31:46.810983 IP (tos 0x0, ttl 81, id 57798, offset 0, flags [DF], proto TCP (6), length 52)
    channel-proxy-shv-04-frc3.facebook.com.https > d-69-91-181-31.dhcp4.washington.edu.54443: Flags [.], cksum 0x5d84 (correct), ack 594, win 148, options [nop,nop,TS val 1934280853 ecr 204801253], length 0
00:31:46.816697 IP (tos 0xc0, ttl 1, id 51334, offset 0, flags [none], proto IGMP (2), length 32, options (RA))
    ae3--2888.uwar-atg-1.infra.washington.edu > 224.0.0.252: igmp query v2 [max resp time 10] [gaddr 224.0.0.252]
00:31:48.050340 IP (tos 0x0, ttl 81, id 33184, offset 0, flags [DF], proto TCP (6), length 137)
    channel-proxy-shv-04-frc3.facebook.com.https > d-69-91-181-31.dhcp4.washington.edu.54442: Flags [P.], cksum 0x1241 (correct), seq 1608800161:1608800246, ack 3184832351, win 129, options [nop,nop,TS val 2708607350 ecr 204752481], length 85
00:31:48.050344 IP (tos 0x0, ttl 81, id 33185, offset 0, flags [DF], proto TCP (6), length 121)
    channel-proxy-shv-04-frc3.facebook.com.https > d-69-91-181-31.dhcp4.washington.edu.54442: Flags [P.], cksum 0xf2ef (correct), seq 85:154, ack 1, win 129, options [nop,nop,TS val 2708607350 ecr 204752481], length 69
00:31:48.050416 IP (tos 0x0, ttl 64, id 44068, offset 0, flags [DF], proto TCP (6), length 52)
    d-69-91-181-31.dhcp4.washington.edu.54442 > channel-proxy-shv-04-frc3.facebook.com.https: Flags [.], cksum 0x7eac (correct), ack 85, win 8186, options [nop,nop,TS val 204802557 ecr 2708607350], length 0
00:31:48.050416 IP (tos 0x0, ttl 64, id 27066, offset 0, flags [DF], proto TCP (6), length 52)
    d-69-91-181-31.dhcp4.washington.edu.54442 > channel-proxy-shv-04-frc3.facebook.com.https: Flags [.], cksum 0x7e6b (correct), ack 154, win 8182, options [nop,nop,TS val 204802557 ecr 2708607350], length 0
00:31:48.054764 IP (tos 0x0, ttl 64, id 12152, offset 0, flags [DF], proto TCP (6), length 1321)
    d-69-91-181-31.dhcp4.washington.edu.54442 > channel-proxy-shv-04-frc3.facebook.com.https: Flags [P.], cksum 0x9fa7 (correct), seq 1:1270, ack 154, win 8192, options [nop,nop,TS val 204802561 ecr 2708607350], length 1269
00:31:48.131891 IP (tos 0x0, ttl 81, id 33186, offset 0, flags [DF], proto TCP (6), length 52)
    channel-proxy-shv-04-frc3.facebook.com.https > d-69-91-181-31.dhcp4.washington.edu.54442: Flags [.], cksum 0x9825 (correct), ack 1270, win 140, options [nop,nop,TS val 2708607533 ecr 204802561], length 0
00:31:48.132681 IP (tos 0x0, ttl 81, id 33187, offset 0, flags [DF], proto TCP (6), length 308)
    channel-proxy-shv-04-frc3.facebook.com.https > d-69-91-181-31.dhcp4.washington.edu.54442: Flags [.], cksum 0xb720 (correct), seq 154:410, ack 1270, win 140, options [nop,nop,TS val 2708607533 ecr 204802561], length 256
00:31:48.134545 IP (tos 0x0, ttl 81, id 33188, offset 0, flags [DF], proto TCP (6), length 233)
    channel-proxy-shv-04-frc3.facebook.com.https > d-69-91-181-31.dhcp4.washington.edu.54442: Flags [P.], cksum 0x8ddb (correct), seq 410:591, ack 1270, win 140, options [nop,nop,TS val 2708607533 ecr 204802561], length 181
00:31:48.134549 IP (tos 0x0, ttl 81, id 33189, offset 0, flags [DF], proto TCP (6), length 137)
    channel-proxy-shv-04-frc3.facebook.com.https > d-69-91-181-31.dhcp4.washington.edu.54442: Flags [P.], cksum 0x5417 (correct), seq 591:676, ack 1270, win 140, options [nop,nop,TS val 2708607533 ecr 204802561], length 85
00:31:48.134616 IP (tos 0x0, ttl 64, id 16095, offset 0, flags [DF], proto TCP (6), length 52)
    d-69-91-181-31.dhcp4.washington.edu.54442 > channel-proxy-shv-04-frc3.facebook.com.https: Flags [.], cksum 0x76b9 (correct), ack 591, win 8180, options [nop,nop,TS val 204802640 ecr 2708607533], length 0
00:31:48.134617 IP (tos 0x0, ttl 64, id 48419, offset 0, flags [DF], proto TCP (6), length 52)
    d-69-91-181-31.dhcp4.washington.edu.54442 > channel-proxy-shv-04-frc3.facebook.com.https: Flags [.], cksum 0x7669 (correct), ack 676, win 8175, options [nop,nop,TS val 204802640 ecr 2708607533], length 0
00:31:48.250068 IP (tos 0xc0, ttl 1, id 3717, offset 0, flags [none], proto IGMP (2), length 32, options (RA))
    ae3--2888.uwar-atg-1.infra.washington.edu > 224.0.0.252: igmp query v2 [max resp time 10] [gaddr 224.0.0.252]
00:31:48.250790 IP (tos 0xc0, ttl 1, id 3917, offset 0, flags [none], proto IGMP (2), length 32, options (RA))
    ae3--2888.uwar-atg-1.infra.washington.edu > 224.0.0.252: igmp query v2 [max resp time 10] [gaddr 224.0.0.252]
00:31:48.353193 ARP, Ethernet (len 6), IPv4 (len 4), Request who-has d-128-208-46-19.dhcp4.washington.edu tell d-128-208-46-19.dhcp4.washington.edu, length 42
00:31:48.590072 IP (tos 0x0, ttl 255, id 19715, offset 0, flags [none], proto UDP (17), length 72)
    d-69-91-181-31.dhcp4.washington.edu.49958 > dns1.cac.washington.edu.domain: 18594+ PTR? 19.46.208.128.in-addr.arpa. (44)
00:31:48.604328 IP (tos 0x0, ttl 59, id 106, offset 0, flags [none], proto UDP (17), length 270)
    dns1.cac.washington.edu.domain > d-69-91-181-31.dhcp4.washington.edu.49958: 18594* 1/3/4 19.46.208.128.in-addr.arpa. PTR D-128-208-46-19.dhcp4.washington.edu. (242)
00:31:49.069181 IP (tos 0xc0, ttl 1, id 19058, offset 0, flags [none], proto IGMP (2), length 32, options (RA))
    ae3--2888.uwar-atg-1.infra.washington.edu > 224.0.0.252: igmp query v2 [max resp time 10] [gaddr 224.0.0.252]
00:31:49.478768 ARP, Ethernet (len 6), IPv4 (len 4), Request who-has d-69-91-177-241.dhcp4.washington.edu tell d-69-91-177-241.dhcp4.washington.edu, length 42
00:31:49.581456 ARP, Ethernet (len 6), IPv4 (len 4), Request who-has d-108-179-179-105.dhcp4.washington.edu tell d-108-179-179-105.dhcp4.washington.edu, length 42
00:31:49.606405 IP (tos 0x0, ttl 255, id 42923, offset 0, flags [none], proto UDP (17), length 72)
    d-69-91-181-31.dhcp4.washington.edu.57008 > dns1.cac.washington.edu.domain: 28108+ PTR? 241.177.91.69.in-addr.arpa. (44)
00:31:49.611409 IP (tos 0x0, ttl 59, id 107, offset 0, flags [none], proto UDP (17), length 270)
    dns1.cac.washington.edu.domain > d-69-91-181-31.dhcp4.washington.edu.57008: 28108* 1/3/4 241.177.91.69.in-addr.arpa. PTR D-69-91-177-241.dhcp4.washington.edu. (242)
00:31:49.611860 IP (tos 0x0, ttl 255, id 11162, offset 0, flags [none], proto UDP (17), length 74)
    d-69-91-181-31.dhcp4.washington.edu.60151 > dns1.cac.washington.edu.domain: 44953+ PTR? 105.179.179.108.in-addr.arpa. (46)
00:31:49.615758 IP (tos 0x0, ttl 59, id 108, offset 0, flags [none], proto UDP (17), length 274)
    dns1.cac.washington.edu.domain > d-69-91-181-31.dhcp4.washington.edu.60151: 44953* 1/3/4 105.179.179.108.in-addr.arpa. PTR D-108-179-179-105.dhcp4.washington.edu. (246)
00:31:49.683391 ARP, Ethernet (len 6), IPv4 (len 4), Request who-has d-69-91-177-241.dhcp4.washington.edu tell d-69-91-177-241.dhcp4.washington.edu, length 42
00:31:50.097711 ARP, Ethernet (len 6), IPv4 (len 4), Request who-has d-69-91-177-241.dhcp4.washington.edu tell d-69-91-177-241.dhcp4.washington.edu, length 42
00:31:50.097740 IP (tos 0xc0, ttl 1, id 36706, offset 0, flags [none], proto IGMP (2), length 32, options (RA))
    ae3--2888.uwar-atg-1.infra.washington.edu > 224.0.0.252: igmp query v2 [max resp time 10] [gaddr 224.0.0.252]
00:31:52.038793 IP (tos 0xc0, ttl 1, id 3671, offset 0, flags [none], proto IGMP (2), length 32, options (RA))
    ae3--2888.uwar-atg-1.infra.washington.edu > 224.0.0.252: igmp query v2 [max resp time 10] [gaddr 224.0.0.252]
00:31:52.960168 IP (tos 0xc0, ttl 1, id 18840, offset 0, flags [none], proto IGMP (2), length 32, options (RA))
    ae3--2888.uwar-atg-1.infra.washington.edu > 224.0.0.252: igmp query v2 [max resp time 10] [gaddr 224.0.0.252]
00:31:53.984354 IP (tos 0xc0, ttl 1, id 36172, offset 0, flags [none], proto IGMP (2), length 32, options (RA))
    ae3--2888.uwar-atg-1.infra.washington.edu > 224.0.0.252: igmp query v2 [max resp time 10] [gaddr 224.0.0.252]
00:31:54.905880 IP (tos 0xc0, ttl 1, id 51422, offset 0, flags [none], proto IGMP (2), length 32, options (RA))
    ae3--2888.uwar-atg-1.infra.washington.edu > 224.0.0.113: igmp query v2 [max resp time 10] [gaddr 224.0.0.113]
00:31:55.315613 ARP, Ethernet (len 6), IPv4 (len 4), Request who-has d-69-91-177-84.dhcp4.washington.edu tell d-69-91-177-84.dhcp4.washington.edu, length 42
00:31:55.417658 ARP, Ethernet (len 6), IPv4 (len 4), Request who-has d-173-250-177-131.dhcp4.washington.edu tell d-173-250-177-131.dhcp4.washington.edu, length 42
00:31:55.622597 IP (tos 0x0, ttl 255, id 18785, offset 0, flags [none], proto UDP (17), length 71)
    d-69-91-181-31.dhcp4.washington.edu.55706 > dns1.cac.washington.edu.domain: 51504+ PTR? 84.177.91.69.in-addr.arpa. (43)
00:31:55.636043 IP (tos 0x0, ttl 59, id 109, offset 0, flags [none], proto UDP (17), length 268)
    dns1.cac.washington.edu.domain > d-69-91-181-31.dhcp4.washington.edu.55706: 51504* 1/3/4 84.177.91.69.in-addr.arpa. PTR D-69-91-177-84.dhcp4.washington.edu. (240)
00:31:55.931041 IP (tos 0xc0, ttl 1, id 3108, offset 0, flags [none], proto IGMP (2), length 32, options (RA))
    ae3--2888.uwar-atg-1.infra.washington.edu > 224.0.0.113: igmp query v2 [max resp time 10] [gaddr 224.0.0.113]
00:31:59.002548 IP (tos 0xc0, ttl 1, id 55719, offset 0, flags [none], proto IGMP (2), length 32, options (RA))
    ae3--2888.uwar-atg-1.infra.washington.edu > 224.0.0.252: igmp query v2 [max resp time 10] [gaddr 224.0.0.252]
00:31:59.412471 ARP, Ethernet (len 6), IPv4 (len 4), Request who-has d-69-91-177-213.dhcp4.washington.edu tell d-69-91-177-213.dhcp4.washington.edu, length 42
00:31:59.641129 IP (tos 0x0, ttl 255, id 44199, offset 0, flags [none], proto UDP (17), length 72)
    d-69-91-181-31.dhcp4.washington.edu.49858 > dns1.cac.washington.edu.domain: 8962+ PTR? 213.177.91.69.in-addr.arpa. (44)
00:31:59.644575 IP (tos 0x0, ttl 59, id 110, offset 0, flags [none], proto UDP (17), length 270)
    dns1.cac.washington.edu.domain > d-69-91-181-31.dhcp4.washington.edu.49858: 8962* 1/3/4 213.177.91.69.in-addr.arpa. PTR D-69-91-177-213.dhcp4.washington.edu. (242)
00:32:00.128720 IP (tos 0xc0, ttl 1, id 9396, offset 0, flags [none], proto IGMP (2), length 32, options (RA))
    ae3--2888.uwar-atg-1.infra.washington.edu > 224.0.0.252: igmp query v2 [max resp time 10] [gaddr 224.0.0.252]
00:32:01.051004 IP (tos 0xc0, ttl 1, id 23232, offset 0, flags [none], proto IGMP (2), length 32, options (RA))
    ae3--2888.uwar-atg-1.infra.washington.edu > 224.0.0.252: igmp query v2 [max resp time 10] [gaddr 224.0.0.252]
00:32:01.051201 IP (tos 0xc0, ttl 1, id 23235, offset 0, flags [none], proto IGMP (2), length 32, options (RA))
    ae3--2888.uwar-atg-1.infra.washington.edu > 224.0.0.252: igmp query v2 [max resp time 10] [gaddr 224.0.0.252]
00:32:02.074258 IP (tos 0xc0, ttl 1, id 35712, offset 0, flags [none], proto IGMP (2), length 32, options (RA))
    ae3--2888.uwar-atg-1.infra.washington.edu > 224.0.0.252: igmp query v2 [max resp time 10] [gaddr 224.0.0.252]
00:32:02.383290 ARP, Ethernet (len 6), IPv4 (len 4), Request who-has d-173-250-177-131.dhcp4.washington.edu tell d-173-250-177-131.dhcp4.washington.edu, length 42
00:32:02.791226 IP (tos 0xc0, ttl 1, id 44682, offset 0, flags [none], proto IGMP (2), length 32, options (RA))
    ae3--2888.uwar-atg-1.infra.washington.edu > 224.0.0.252: igmp query v2 [max resp time 10] [gaddr 224.0.0.252]
00:32:02.791233 IP (tos 0xc0, ttl 1, id 44987, offset 0, flags [none], proto IGMP (2), length 32, options (RA))
    ae3--2888.uwar-atg-1.infra.washington.edu > 224.0.0.252: igmp query v2 [max resp time 10] [gaddr 224.0.0.252]
00:32:03.815146 IP (tos 0xc0, ttl 1, id 55607, offset 0, flags [none], proto IGMP (2), length 32, options (RA))
    ae3--2888.uwar-atg-1.infra.washington.edu > 224.0.0.252: igmp query v2 [max resp time 10] [gaddr 224.0.0.252]
00:32:04.226340 ARP, Ethernet (len 6), IPv4 (len 4), Request who-has d-128-95-62-126.dhcp4.washington.edu tell d-128-95-62-126.dhcp4.washington.edu, length 42
00:32:04.650107 IP (tos 0x0, ttl 255, id 62042, offset 0, flags [none], proto UDP (17), length 72)
    d-69-91-181-31.dhcp4.washington.edu.65027 > dns1.cac.washington.edu.domain: 37074+ PTR? 126.62.95.128.in-addr.arpa. (44)
00:32:04.653232 IP (tos 0x0, ttl 59, id 111, offset 0, flags [none], proto UDP (17), length 270)
    dns1.cac.washington.edu.domain > d-69-91-181-31.dhcp4.washington.edu.65027: 37074* 1/3/4 126.62.95.128.in-addr.arpa. PTR D-128-95-62-126.dhcp4.washington.edu. (242)
00:32:04.931454 IP (tos 0x0, ttl 56, id 57126, offset 0, flags [none], proto TCP (6), length 117)
    sea09s16-in-f9.1e100.net.https > d-69-91-181-31.dhcp4.washington.edu.54416: Flags [P.], cksum 0xde78 (correct), seq 2525193600:2525193665, ack 1183117777, win 414, options [nop,nop,TS val 1368862523 ecr 204579949], length 65
00:32:04.931530 ARP, Ethernet (len 6), IPv4 (len 4), Request who-has ae3--2888.uwar-atg-1.infra.washington.edu (00:00:5e:00:01:05 (oui Unknown)) tell d-69-91-181-31.dhcp4.washington.edu, length 28
00:32:04.931635 IP (tos 0x0, ttl 56, id 57127, offset 0, flags [none], proto TCP (6), length 97)
    sea09s16-in-f9.1e100.net.https > d-69-91-181-31.dhcp4.washington.edu.54416: Flags [P.], cksum 0x675e (correct), seq 65:110, ack 1, win 414, options [nop,nop,TS val 1368862523 ecr 204579949], length 45
00:32:04.931832 IP (tos 0x0, ttl 56, id 57128, offset 0, flags [none], proto TCP (6), length 52)
    sea09s16-in-f9.1e100.net.https > d-69-91-181-31.dhcp4.washington.edu.54416: Flags [F.], cksum 0x6ef3 (correct), seq 110, ack 1, win 414, options [nop,nop,TS val 1368862523 ecr 204579949], length 0
00:32:04.934522 ARP, Ethernet (len 6), IPv4 (len 4), Reply ae3--2888.uwar-atg-1.infra.washington.edu is-at 00:00:5e:00:01:05 (oui Unknown), length 42
00:32:04.934562 IP (tos 0x0, ttl 64, id 27199, offset 0, flags [DF], proto TCP (6), length 52)
    d-69-91-181-31.dhcp4.washington.edu.54416 > sea09s16-in-f9.1e100.net.https: Flags [F.], cksum 0xa913 (correct), seq 1, ack 111, win 8192, options [nop,nop,TS val 204819430 ecr 1368862523], length 0
00:32:04.937637 IP (tos 0x0, ttl 56, id 57129, offset 0, flags [none], proto TCP (6), length 52)
    sea09s16-in-f9.1e100.net.https > d-69-91-181-31.dhcp4.washington.edu.54416: Flags [.], cksum 0xc76d (correct), ack 2, win 414, options [nop,nop,TS val 1368862531 ecr 204819430], length 0
00:32:04.937767 IP (tos 0x0, ttl 64, id 7405, offset 0, flags [DF], proto TCP (6), length 52)
    d-69-91-181-31.dhcp4.washington.edu.54416 > sea09s16-in-f9.1e100.net.https: Flags [.], cksum 0xa905 (correct), ack 111, win 8192, options [nop,nop,TS val 204819436 ecr 1368862531], length 0
00:32:04.991562 IP (tos 0x0, ttl 52, id 14920, offset 0, flags [DF], proto TCP (6), length 137)
    live.github.com.https > d-69-91-181-31.dhcp4.washington.edu.54413: Flags [P.], cksum 0x82a2 (correct), seq 1032749144:1032749229, ack 2378476756, win 17, options [nop,nop,TS val 942945961 ecr 204759455], length 85
00:32:04.991566 IP (tos 0x0, ttl 52, id 30153, offset 0, flags [DF], proto TCP (6), length 137)
    live.github.com.https > d-69-91-181-31.dhcp4.washington.edu.54415: Flags [P.], cksum 0x4112 (correct), seq 3511766193:3511766278, ack 494000317, win 17, options [nop,nop,TS val 942945961 ecr 204759458], length 85
00:32:04.991654 IP (tos 0x0, ttl 64, id 12155, offset 0, flags [DF], proto TCP (6), length 52)
    d-69-91-181-31.dhcp4.washington.edu.54413 > live.github.com.https: Flags [.], cksum 0x0982 (correct), ack 85, win 8186, options [nop,nop,TS val 204819489 ecr 942945961], length 0
00:32:04.991655 IP (tos 0x0, ttl 64, id 47518, offset 0, flags [DF], proto TCP (6), length 52)
    d-69-91-181-31.dhcp4.washington.edu.54415 > live.github.com.https: Flags [.], cksum 0xedcd (correct), ack 85, win 8186, options [nop,nop,TS val 204819489 ecr 942945961], length 0
00:32:04.995202 IP (tos 0x0, ttl 52, id 38387, offset 0, flags [DF], proto TCP (6), length 137)
    live.github.com.https > d-69-91-181-31.dhcp4.washington.edu.54412: Flags [P.], cksum 0x4517 (correct), seq 60550287:60550372, ack 1951318615, win 17, options [nop,nop,TS val 942945960 ecr 204759459], length 85
00:32:04.995254 IP (tos 0x0, ttl 64, id 42824, offset 0, flags [DF], proto TCP (6), length 52)
    d-69-91-181-31.dhcp4.washington.edu.54412 > live.github.com.https: Flags [.], cksum 0xdb2f (correct), ack 85, win 8186, options [nop,nop,TS val 204819492 ecr 942945960], length 0
00:32:05.056394 IP (tos 0x0, ttl 52, id 42920, offset 0, flags [DF], proto TCP (6), length 121)
    live.github.com.https > d-69-91-181-31.dhcp4.washington.edu.54414: Flags [P.], cksum 0x6f36 (correct), seq 3613588168:3613588237, ack 4091564222, win 17, options [nop,nop,TS val 942945976 ecr 204759513], length 69
00:32:05.056463 IP (tos 0x0, ttl 64, id 32469, offset 0, flags [DF], proto TCP (6), length 52)
    d-69-91-181-31.dhcp4.washington.edu.54414 > live.github.com.https: Flags [.], cksum 0xeaf6 (correct), ack 69, win 8187, options [nop,nop,TS val 204819552 ecr 942945976], length 0
00:32:05.060956 IP (tos 0x0, ttl 52, id 42921, offset 0, flags [DF], proto TCP (6), length 121)
    live.github.com.https > d-69-91-181-31.dhcp4.washington.edu.54414: Flags [P.], cksum 0xa069 (correct), seq 69:138, ack 1, win 17, options [nop,nop,TS val 942945976 ecr 204759513], length 69
00:32:05.061008 IP (tos 0x0, ttl 64, id 57070, offset 0, flags [DF], proto TCP (6), length 52)
    d-69-91-181-31.dhcp4.washington.edu.54414 > live.github.com.https: Flags [.], cksum 0xeaad (correct), ack 138, win 8187, options [nop,nop,TS val 204819556 ecr 942945976], length 0
00:32:05.655189 IP (tos 0x0, ttl 255, id 42331, offset 0, flags [none], proto UDP (17), length 73)
    d-69-91-181-31.dhcp4.washington.edu.49300 > dns1.cac.washington.edu.domain: 24797+ PTR? 105.33.194.173.in-addr.arpa. (45)
00:32:05.661258 IP (tos 0x0, ttl 59, id 112, offset 0, flags [none], proto UDP (17), length 257)
    dns1.cac.washington.edu.domain > d-69-91-181-31.dhcp4.washington.edu.49300: 24797 1/4/4 105.33.194.173.in-addr.arpa. PTR sea09s16-in-f9.1e100.net. (229)
00:32:07.912369 IP (tos 0xc0, ttl 1, id 29005, offset 0, flags [none], proto IGMP (2), length 32, options (RA))
    ae3--2888.uwar-atg-1.infra.washington.edu > 224.0.0.252: igmp query v2 [max resp time 10] [gaddr 224.0.0.252]
00:32:08.014107 IP (tos 0xc0, ttl 1, id 29052, offset 0, flags [none], proto IGMP (2), length 32, options (RA))
    ae3--2888.uwar-atg-1.infra.washington.edu > 224.0.0.252: igmp query v2 [max resp time 10] [gaddr 224.0.0.252]
00:32:08.938987 IP (tos 0xc0, ttl 1, id 34577, offset 0, flags [none], proto IGMP (2), length 32, options (RA))
    ae3--2888.uwar-atg-1.infra.washington.edu > 224.0.0.252: igmp query v2 [max resp time 10] [gaddr 224.0.0.252]
00:32:11.188548 ARP, Ethernet (len 6), IPv4 (len 4), Request who-has d-69-91-148-67.dhcp4.washington.edu tell d-69-91-148-67.dhcp4.washington.edu, length 42
00:32:12.519590 ARP, Ethernet (len 6), IPv4 (len 4), Request who-has d-108-179-179-116.dhcp4.washington.edu tell d-108-179-179-116.dhcp4.washington.edu, length 46
00:32:12.671144 IP (tos 0x0, ttl 255, id 38889, offset 0, flags [none], proto UDP (17), length 74)
    d-69-91-181-31.dhcp4.washington.edu.51138 > dns1.cac.washington.edu.domain: 42354+ PTR? 116.179.179.108.in-addr.arpa. (46)
00:32:12.675262 IP (tos 0x0, ttl 59, id 113, offset 0, flags [none], proto UDP (17), length 274)
    dns1.cac.washington.edu.domain > d-69-91-181-31.dhcp4.washington.edu.51138: 42354* 1/3/4 116.179.179.108.in-addr.arpa. PTR D-108-179-179-116.dhcp4.washington.edu. (246)
00:32:12.929731 IP (tos 0xc0, ttl 1, id 5735, offset 0, flags [none], proto IGMP (2), length 32, options (RA))
    ae3--2888.uwar-atg-1.infra.washington.edu > 224.0.0.252: igmp query v2 [max resp time 10] [gaddr 224.0.0.252]
00:32:12.929771 IP (tos 0xc0, ttl 1, id 6506, offset 0, flags [none], proto IGMP (2), length 32, options (RA))
    ae3--2888.uwar-atg-1.infra.washington.edu > 224.0.0.252: igmp query v2 [max resp time 10] [gaddr 224.0.0.252]
00:32:13.850957 IP (tos 0xc0, ttl 1, id 18406, offset 0, flags [none], proto IGMP (2), length 32, options (RA))
    ae3--2888.uwar-atg-1.infra.washington.edu > 224.0.0.252: igmp query v2 [max resp time 10] [gaddr 224.0.0.252]
00:32:14.055966 IP (tos 0xc0, ttl 1, id 22003, offset 0, flags [none], proto IGMP (2), length 32, options (RA))
    ae3--2888.uwar-atg-1.infra.washington.edu > 224.0.0.113: igmp query v2 [max resp time 10] [gaddr 224.0.0.113]
00:32:14.772676 IP (tos 0xc0, ttl 1, id 31272, offset 0, flags [none], proto IGMP (2), length 32, options (RA))
    ae3--2888.uwar-atg-1.infra.washington.edu > 224.0.0.252: igmp query v2 [max resp time 10] [gaddr 224.0.0.252]
00:32:14.875321 ARP, Ethernet (len 6), IPv4 (len 4), Request who-has d-173-250-177-248.dhcp4.washington.edu tell d-173-250-177-248.dhcp4.washington.edu, length 42
00:32:15.080165 IP (tos 0xc0, ttl 1, id 34119, offset 0, flags [none], proto IGMP (2), length 32, options (RA))
    ae3--2888.uwar-atg-1.infra.washington.edu > 224.0.0.113: igmp query v2 [max resp time 10] [gaddr 224.0.0.113]
00:32:15.679713 IP (tos 0x0, ttl 255, id 40002, offset 0, flags [none], proto UDP (17), length 74)
    d-69-91-181-31.dhcp4.washington.edu.53346 > dns1.cac.washington.edu.domain: 30102+ PTR? 248.177.250.173.in-addr.arpa. (46)
00:32:15.689686 IP (tos 0x0, ttl 59, id 114, offset 0, flags [none], proto UDP (17), length 202)
    dns1.cac.washington.edu.domain > d-69-91-181-31.dhcp4.washington.edu.53346: 30102* 1/2/2 248.177.250.173.in-addr.arpa. PTR D-173-250-177-248.dhcp4.washington.edu. (174)
00:32:15.898997 ARP, Ethernet (len 6), IPv4 (len 4), Request who-has d-108-179-179-190.dhcp4.washington.edu tell d-108-179-179-190.dhcp4.washington.edu, length 42
00:32:16.618006 ARP, Ethernet (len 6), IPv4 (len 4), Request who-has d-69-91-177-224.dhcp4.washington.edu tell d-69-91-177-224.dhcp4.washington.edu, length 46
00:32:16.692271 IP (tos 0x0, ttl 255, id 35290, offset 0, flags [none], proto UDP (17), length 74)
    d-69-91-181-31.dhcp4.washington.edu.63852 > dns1.cac.washington.edu.domain: 1374+ PTR? 190.179.179.108.in-addr.arpa. (46)
00:32:16.695770 IP (tos 0x0, ttl 59, id 115, offset 0, flags [none], proto UDP (17), length 274)
