00:27:29.626490 IP a96-7-70-165.deploy.akamaitechnologies.com.https > d-69-91-148-226.dhcp4.washington.edu.56834: Flags [P.], seq 1239352151:1239352492, ack 966011717, win 520, options [nop,nop,TS val 661701112 ecr 1052988971], length 341
00:27:29.626551 IP d-69-91-148-226.dhcp4.washington.edu.56834 > a96-7-70-165.deploy.akamaitechnologies.com.https: Flags [.], ack 341, win 8211, options [nop,nop,TS val 1052989044 ecr 661701112], length 0
00:27:29.626926 IP a96-7-70-165.deploy.akamaitechnologies.com.https > d-69-91-148-226.dhcp4.washington.edu.56834: Flags [P.], seq 341:394, ack 1, win 520, options [nop,nop,TS val 661701112 ecr 1052988971], length 53
00:27:29.626952 IP d-69-91-148-226.dhcp4.washington.edu.56834 > a96-7-70-165.deploy.akamaitechnologies.com.https: Flags [.], ack 394, win 8207, options [nop,nop,TS val 1052989044 ecr 661701112], length 0
00:27:29.627395 IP d-69-91-148-226.dhcp4.washington.edu.56834 > a96-7-70-165.deploy.akamaitechnologies.com.https: Flags [F.], seq 1, ack 394, win 8207, options [nop,nop,TS val 1052989044 ecr 661701112], length 0
00:27:29.627996 IP a96-7-70-165.deploy.akamaitechnologies.com.https > d-69-91-148-226.dhcp4.washington.edu.56834: Flags [F.], seq 394, ack 1, win 520, options [nop,nop,TS val 661701112 ecr 1052988971], length 0
00:27:29.630338 IP a96-7-70-165.deploy.akamaitechnologies.com.https > d-69-91-148-226.dhcp4.washington.edu.56834: Flags [.], ack 2, win 520, options [nop,nop,TS val 661701115 ecr 1052989044], length 0
00:27:29.630376 IP d-69-91-148-226.dhcp4.washington.edu.56834 > a96-7-70-165.deploy.akamaitechnologies.com.https: Flags [.], ack 394, win 8207, options [nop,nop,TS val 1052989047 ecr 661701112], length 0
00:27:29.790645 ARP, Request who-has d-173-250-177-12.dhcp4.washington.edu tell d-173-250-177-12.dhcp4.washington.edu, length 42
00:27:29.829217 IP a96-7-70-165.deploy.akamaitechnologies.com.https > d-69-91-148-226.dhcp4.washington.edu.56834: Flags [F.], seq 394, ack 2, win 520, options [nop,nop,TS val 661701315 ecr 1052989047], length 0
00:27:29.829296 IP d-69-91-148-226.dhcp4.washington.edu.56834 > a96-7-70-165.deploy.akamaitechnologies.com.https: Flags [.], ack 395, win 8207, options [nop,nop,TS val 1052989244 ecr 661701315], length 0
00:27:29.892856 IP ae3--2888.uwar-atg-1.infra.washington.edu > 224.0.0.113: igmp query v2 [max resp time 10] [gaddr 224.0.0.113]
00:27:29.987950 IP d-69-91-148-226.dhcp4.washington.edu.56836 > 199.27.79.175.https: Flags [S], seq 980557930, win 65535, options [mss 1460,nop,wscale 4,nop,nop,TS val 1052989401 ecr 0,sackOK,eol], length 0
00:27:29.988096 IP d-69-91-148-226.dhcp4.washington.edu.58848 > dns1.cac.washington.edu.domain: 19922+ A? c.global-ssl.fastly.net. (41)
00:27:29.990644 IP dns1.cac.washington.edu.domain > d-69-91-148-226.dhcp4.washington.edu.58848: 19922 1/4/4 A 23.235.44.175 (204)
00:27:29.992847 IP d-69-91-148-226.dhcp4.washington.edu.56696 > 93.184.216.180.https: Flags [P.], seq 2001365325:2001365697, ack 1233248638, win 8192, options [nop,nop,TS val 1052989405 ecr 3203379327], length 372
00:27:29.995800 IP 93.184.216.180.https > d-69-91-148-226.dhcp4.washington.edu.56696: Flags [P.], seq 1:385, ack 372, win 428, options [nop,nop,TS val 3203381802 ecr 1052989405], length 384
00:27:29.995917 IP d-69-91-148-226.dhcp4.washington.edu.56696 > 93.184.216.180.https: Flags [.], ack 385, win 8168, options [nop,nop,TS val 1052989408 ecr 3203381802], length 0
00:27:29.997047 IP 93.184.216.180.https > d-69-91-148-226.dhcp4.washington.edu.56696: Flags [.], seq 385:1759, ack 372, win 428, options [nop,nop,TS val 3203381802 ecr 1052989405], length 1374
00:27:29.997467 IP 93.184.216.180.https > d-69-91-148-226.dhcp4.washington.edu.56696: Flags [P.], seq 1759:2955, ack 372, win 428, options [nop,nop,TS val 3203381802 ecr 1052989405], length 1196
00:27:29.997470 IP 93.184.216.180.https > d-69-91-148-226.dhcp4.washington.edu.56696: Flags [.], seq 2955:4329, ack 372, win 428, options [nop,nop,TS val 3203381802 ecr 1052989405], length 1374
00:27:29.997509 IP 93.184.216.180.https > d-69-91-148-226.dhcp4.washington.edu.56696: Flags [P.], seq 4329:5660, ack 372, win 428, options [nop,nop,TS val 3203381802 ecr 1052989405], length 1331
00:27:29.997521 IP d-69-91-148-226.dhcp4.washington.edu.56696 > 93.184.216.180.https: Flags [.], ack 2955, win 8117, options [nop,nop,TS val 1052989409 ecr 3203381802], length 0
00:27:29.997545 IP d-69-91-148-226.dhcp4.washington.edu.56696 > 93.184.216.180.https: Flags [.], ack 5660, win 7948, options [nop,nop,TS val 1052989409 ecr 3203381802], length 0
00:27:29.997671 IP d-69-91-148-226.dhcp4.washington.edu.56696 > 93.184.216.180.https: Flags [.], ack 5660, win 8192, options [nop,nop,TS val 1052989409 ecr 3203381802], length 0
00:27:30.016227 IP 199.27.79.175.https > d-69-91-148-226.dhcp4.washington.edu.56836: Flags [S.], seq 359880154, ack 980557931, win 14480, options [mss 1386,sackOK,TS val 1413988894 ecr 1052989401,nop,wscale 9], length 0
00:27:30.016297 IP d-69-91-148-226.dhcp4.washington.edu.56836 > 199.27.79.175.https: Flags [.], ack 1, win 8244, options [nop,nop,TS val 1052989428 ecr 1413988894], length 0
00:27:30.016580 IP d-69-91-148-226.dhcp4.washington.edu.56836 > 199.27.79.175.https: Flags [P.], seq 1:518, ack 1, win 8244, options [nop,nop,TS val 1052989428 ecr 1413988894], length 517
00:27:30.032739 IP d-69-91-148-226.dhcp4.washington.edu.56692 > 198.41.209.190.https: Flags [.], seq 2397677028:2397678414, ack 3718861786, win 16384, length 1386
00:27:30.032739 IP d-69-91-148-226.dhcp4.washington.edu.56692 > 198.41.209.190.https: Flags [.], seq 1386:2772, ack 1, win 16384, length 1386
00:27:30.032740 IP d-69-91-148-226.dhcp4.washington.edu.56692 > 198.41.209.190.https: Flags [.], seq 2772:4158, ack 1, win 16384, length 1386
00:27:30.032806 IP d-69-91-148-226.dhcp4.washington.edu.56692 > 198.41.209.190.https: Flags [P.], seq 4158:4166, ack 1, win 16384, length 8
00:27:30.045245 IP 199.27.79.175.https > d-69-91-148-226.dhcp4.washington.edu.56836: Flags [.], ack 518, win 31, options [nop,nop,TS val 1413988901 ecr 1052989428], length 0
00:27:30.045366 IP 199.27.79.175.https > d-69-91-148-226.dhcp4.washington.edu.56836: Flags [P.], seq 1:142, ack 518, win 31, options [nop,nop,TS val 1413988901 ecr 1052989428], length 141
00:27:30.045417 IP d-69-91-148-226.dhcp4.washington.edu.56836 > 199.27.79.175.https: Flags [.], ack 142, win 8235, options [nop,nop,TS val 1052989456 ecr 1413988901], length 0
00:27:30.045827 IP d-69-91-148-226.dhcp4.washington.edu.56836 > 199.27.79.175.https: Flags [P.], seq 518:569, ack 142, win 8235, options [nop,nop,TS val 1052989456 ecr 1413988901], length 51
00:27:30.056509 IP d-69-91-148-226.dhcp4.washington.edu.61496 > dns1.cac.washington.edu.domain: 14542+ A? ssl-google-analytics.l.google.com. (51)
00:27:30.057132 IP 198.41.209.190.https > d-69-91-148-226.dhcp4.washington.edu.56692: Flags [.], ack 2772, win 163, length 0
00:27:30.058120 IP 198.41.209.190.https > d-69-91-148-226.dhcp4.washington.edu.56692: Flags [.], ack 4166, win 166, length 0
00:27:30.060158 IP dns1.cac.washington.edu.domain > d-69-91-148-226.dhcp4.washington.edu.61496: 14542 1/4/4 A 173.194.33.126 (203)
00:27:30.060312 IP d-69-91-148-226.dhcp4.washington.edu.56837 > sea09s17-in-f26.1e100.net.https: Flags [S], seq 3713591674, win 65535, options [mss 1460,nop,wscale 4,nop,nop,TS val 1052989470 ecr 0,sackOK,eol], length 0
00:27:30.062759 IP d-69-91-148-226.dhcp4.washington.edu.56838 > 199.27.79.130.https: Flags [S], seq 1373267940, win 65535, options [mss 1460,nop,wscale 4,nop,nop,TS val 1052989472 ecr 0,sackOK,eol], length 0
00:27:30.062988 IP d-69-91-148-226.dhcp4.washington.edu.57404 > dns1.cac.washington.edu.domain: 29918+ A? a.ssl.fastly.net. (34)
00:27:30.063414 IP sea09s17-in-f26.1e100.net.https > d-69-91-148-226.dhcp4.washington.edu.56837: Flags [S.], seq 1129562502, ack 3713591675, win 42540, options [mss 1386,sackOK,TS val 1536114962 ecr 1052989470,nop,wscale 7], length 0
00:27:30.063467 IP d-69-91-148-226.dhcp4.washington.edu.56837 > sea09s17-in-f26.1e100.net.https: Flags [.], ack 1, win 8244, options [nop,nop,TS val 1052989472 ecr 1536114962], length 0
00:27:30.063653 IP d-69-91-148-226.dhcp4.washington.edu.56837 > sea09s17-in-f26.1e100.net.https: Flags [P.], seq 1:518, ack 1, win 8244, options [nop,nop,TS val 1052989473 ecr 1536114962], length 517
00:27:30.066468 IP dns1.cac.washington.edu.domain > d-69-91-148-226.dhcp4.washington.edu.57404: 29918 1/4/4 A 199.27.79.130 (197)
00:27:30.070813 IP sea09s17-in-f26.1e100.net.https > d-69-91-148-226.dhcp4.washington.edu.56837: Flags [.], ack 518, win 341, options [nop,nop,TS val 1536114970 ecr 1052989473], length 0
00:27:30.071203 IP sea09s17-in-f26.1e100.net.https > d-69-91-148-226.dhcp4.washington.edu.56837: Flags [P.], seq 1:182, ack 518, win 341, options [nop,nop,TS val 1536114970 ecr 1052989473], length 181
00:27:30.071247 IP d-69-91-148-226.dhcp4.washington.edu.56837 > sea09s17-in-f26.1e100.net.https: Flags [.], ack 182, win 8232, options [nop,nop,TS val 1052989480 ecr 1536114970], length 0
00:27:30.071665 IP d-69-91-148-226.dhcp4.washington.edu.56837 > sea09s17-in-f26.1e100.net.https: Flags [P.], seq 518:605, ack 182, win 8232, options [nop,nop,TS val 1052989480 ecr 1536114970], length 87
00:27:30.073500 IP 199.27.79.175.https > d-69-91-148-226.dhcp4.washington.edu.56836: Flags [.], ack 569, win 31, options [nop,nop,TS val 1413988908 ecr 1052989456], length 0
00:27:30.074965 IP sea09s17-in-f26.1e100.net.https > d-69-91-148-226.dhcp4.washington.edu.56837: Flags [P.], seq 182:239, ack 605, win 341, options [nop,nop,TS val 1536114975 ecr 1052989480], length 57
00:27:30.075033 IP d-69-91-148-226.dhcp4.washington.edu.56837 > sea09s17-in-f26.1e100.net.https: Flags [.], ack 239, win 8229, options [nop,nop,TS val 1052989483 ecr 1536114975], length 0
00:27:30.076721 IP sea09s17-in-f26.1e100.net.https > d-69-91-148-226.dhcp4.washington.edu.56837: Flags [P.], seq 239:284, ack 605, win 341, options [nop,nop,TS val 1536114975 ecr 1052989480], length 45
00:27:30.076772 IP d-69-91-148-226.dhcp4.washington.edu.56837 > sea09s17-in-f26.1e100.net.https: Flags [.], ack 284, win 8226, options [nop,nop,TS val 1052989484 ecr 1536114975], length 0
00:27:30.091769 IP 199.27.79.130.https > d-69-91-148-226.dhcp4.washington.edu.56838: Flags [S.], seq 3620246873, ack 1373267941, win 14480, options [mss 1386,sackOK,TS val 1392941304 ecr 1052989472,nop,wscale 9], length 0
00:27:30.091833 IP d-69-91-148-226.dhcp4.washington.edu.56838 > 199.27.79.130.https: Flags [.], ack 1, win 8244, options [nop,nop,TS val 1052989498 ecr 1392941304], length 0
00:27:30.097967 ARP, Request who-has d-173-250-177-12.dhcp4.washington.edu tell d-173-250-177-12.dhcp4.washington.edu, length 42
00:27:30.178946 IP d-69-91-148-226.dhcp4.washington.edu.65524 > dns1.cac.washington.edu.domain: 24305+ A? prod-pixel-collector-1097235636.us-east-1.elb.amazonaws.com. (77)
00:27:30.183288 IP d-69-91-148-226.dhcp4.washington.edu.56837 > sea09s17-in-f26.1e100.net.https: Flags [P.], seq 605:670, ack 284, win 8226, options [nop,nop,TS val 1052989589 ecr 1536114975], length 65
00:27:30.183346 IP d-69-91-148-226.dhcp4.washington.edu.56837 > sea09s17-in-f26.1e100.net.https: Flags [P.], seq 670:715, ack 284, win 8226, options [nop,nop,TS val 1052989589 ecr 1536114975], length 45
00:27:30.183511 IP d-69-91-148-226.dhcp4.washington.edu.56701 > sea09s16-in-f30.1e100.net.https: Flags [P.], seq 3724534422:3724535424, ack 1694194181, win 8192, options [nop,nop,TS val 1052989589 ecr 1368581835], length 1002
00:27:30.183682 IP d-69-91-148-226.dhcp4.washington.edu.56838 > 199.27.79.130.https: Flags [P.], seq 1:518, ack 1, win 8244, options [nop,nop,TS val 1052989589 ecr 1392941304], length 517
00:27:30.183857 IP d-69-91-148-226.dhcp4.washington.edu.56701 > sea09s16-in-f30.1e100.net.https: Flags [P.], seq 1002:2005, ack 1, win 8192, options [nop,nop,TS val 1052989589 ecr 1368581835], length 1003
00:27:30.184161 IP d-69-91-148-226.dhcp4.washington.edu.56702 > sea09s17-in-f25.1e100.net.https: Flags [P.], seq 2874075444:2874076484, ack 2559279237, win 8192, options [nop,nop,TS val 1052989589 ecr 1536113176], length 1040
00:27:30.184630 IP d-69-91-148-226.dhcp4.washington.edu.56837 > sea09s17-in-f26.1e100.net.https: Flags [P.], seq 715:746, ack 284, win 8226, options [nop,nop,TS val 1052989590 ecr 1536114975], length 31
00:27:30.184638 IP d-69-91-148-226.dhcp4.washington.edu.56837 > sea09s17-in-f26.1e100.net.https: Flags [F.], seq 746, ack 284, win 8226, options [nop,nop,TS val 1052989590 ecr 1536114975], length 0
00:27:30.185098 IP d-69-91-148-226.dhcp4.washington.edu.56839 > ec2-50-16-225-31.compute-1.amazonaws.com.https: Flags [S], seq 683168604, win 65535, options [mss 1460,nop,wscale 4,nop,nop,TS val 1052989590 ecr 0,sackOK,eol], length 0
00:27:30.185216 IP d-69-91-148-226.dhcp4.washington.edu.56840 > ec2-50-16-225-31.compute-1.amazonaws.com.https: Flags [S], seq 4152381366, win 65535, options [mss 1460,nop,wscale 4,nop,nop,TS val 1052989590 ecr 0,sackOK,eol], length 0
00:27:30.187139 IP sea09s17-in-f26.1e100.net.https > d-69-91-148-226.dhcp4.washington.edu.56837: Flags [.], ack 715, win 341, options [nop,nop,TS val 1536115086 ecr 1052989589], length 0
00:27:30.187194 IP d-69-91-148-226.dhcp4.washington.edu.56837 > sea09s17-in-f26.1e100.net.https: Flags [F.], seq 746, ack 284, win 8226, options [nop,nop,TS val 1052989592 ecr 1536115086], length 0
00:27:30.188337 IP sea09s16-in-f30.1e100.net.https > d-69-91-148-226.dhcp4.washington.edu.56701: Flags [.], ack 2005, win 692, options [nop,nop,TS val 1368583744 ecr 1052989589], length 0
00:27:30.189089 IP sea09s17-in-f26.1e100.net.https > d-69-91-148-226.dhcp4.washington.edu.56837: Flags [F.], seq 284, ack 747, win 341, options [nop,nop,TS val 1536115087 ecr 1052989590], length 0
00:27:30.189149 IP d-69-91-148-226.dhcp4.washington.edu.56837 > sea09s17-in-f26.1e100.net.https: Flags [.], ack 285, win 8226, options [nop,nop,TS val 1052989593 ecr 1536115087], length 0
00:27:30.191111 IP sea09s17-in-f26.1e100.net.https > d-69-91-148-226.dhcp4.washington.edu.56837: Flags [.], ack 747, win 341, options [nop,nop,TS val 1536115089 ecr 1052989592,nop,nop,sack 1 {746:747}], length 0
00:27:30.194373 IP sea09s16-in-f30.1e100.net.https > d-69-91-148-226.dhcp4.washington.edu.56701: Flags [P.], seq 1:151, ack 2005, win 692, options [nop,nop,TS val 1368583752 ecr 1052989589], length 150
00:27:30.194463 IP d-69-91-148-226.dhcp4.washington.edu.56701 > sea09s16-in-f30.1e100.net.https: Flags [.], ack 151, win 8182, options [nop,nop,TS val 1052989598 ecr 1368583752], length 0
00:27:30.195669 IP sea09s16-in-f30.1e100.net.https > d-69-91-148-226.dhcp4.washington.edu.56701: Flags [P.], seq 151:264, ack 2005, win 692, options [nop,nop,TS val 1368583752 ecr 1052989589], length 113
00:27:30.195770 IP sea09s16-in-f30.1e100.net.https > d-69-91-148-226.dhcp4.washington.edu.56701: Flags [P.], seq 264:317, ack 2005, win 692, options [nop,nop,TS val 1368583752 ecr 1052989589], length 53
00:27:30.195776 IP sea09s16-in-f30.1e100.net.https > d-69-91-148-226.dhcp4.washington.edu.56701: Flags [P.], seq 317:430, ack 2005, win 692, options [nop,nop,TS val 1368583752 ecr 1052989589], length 113
00:27:30.195797 IP d-69-91-148-226.dhcp4.washington.edu.56701 > sea09s16-in-f30.1e100.net.https: Flags [.], ack 264, win 8184, options [nop,nop,TS val 1052989599 ecr 1368583752], length 0
00:27:30.195850 IP d-69-91-148-226.dhcp4.washington.edu.56701 > sea09s16-in-f30.1e100.net.https: Flags [.], ack 317, win 8181, options [nop,nop,TS val 1052989599 ecr 1368583752], length 0
00:27:30.195869 IP d-69-91-148-226.dhcp4.washington.edu.56701 > sea09s16-in-f30.1e100.net.https: Flags [.], ack 430, win 8179, options [nop,nop,TS val 1052989599 ecr 1368583752], length 0
00:27:30.196120 IP d-69-91-148-226.dhcp4.washington.edu.56701 > sea09s16-in-f30.1e100.net.https: Flags [P.], seq 2005:2046, ack 430, win 8181, options [nop,nop,TS val 1052989599 ecr 1368583752], length 41
00:27:30.196255 IP d-69-91-148-226.dhcp4.washington.edu.56701 > sea09s16-in-f30.1e100.net.https: Flags [P.], seq 2046:2087, ack 430, win 8192, options [nop,nop,TS val 1052989599 ecr 1368583752], length 41
00:27:30.196566 IP sea09s17-in-f25.1e100.net.https > d-69-91-148-226.dhcp4.washington.edu.56702: Flags [P.], seq 1:76, ack 1040, win 529, options [nop,nop,TS val 1536115097 ecr 1052989589], length 75
00:27:30.196616 IP d-69-91-148-226.dhcp4.washington.edu.56702 > sea09s17-in-f25.1e100.net.https: Flags [.], ack 76, win 8187, options [nop,nop,TS val 1052989599 ecr 1536115097], length 0
00:27:30.201927 IP sea09s17-in-f25.1e100.net.https > d-69-91-148-226.dhcp4.washington.edu.56702: Flags [P.], seq 76:155, ack 1040, win 529, options [nop,nop,TS val 1536115097 ecr 1052989589], length 79
00:27:30.202018 IP d-69-91-148-226.dhcp4.washington.edu.56702 > sea09s17-in-f25.1e100.net.https: Flags [.], ack 155, win 8187, options [nop,nop,TS val 1052989605 ecr 1536115097], length 0
00:27:30.202495 IP sea09s17-in-f25.1e100.net.https > d-69-91-148-226.dhcp4.washington.edu.56702: Flags [P.], seq 155:196, ack 1040, win 529, options [nop,nop,TS val 1536115097 ecr 1052989589], length 41
00:27:30.202546 IP d-69-91-148-226.dhcp4.washington.edu.56702 > sea09s17-in-f25.1e100.net.https: Flags [.], ack 196, win 8189, options [nop,nop,TS val 1052989605 ecr 1536115097], length 0
00:27:30.202684 IP d-69-91-148-226.dhcp4.washington.edu.56702 > sea09s17-in-f25.1e100.net.https: Flags [P.], seq 1040:1081, ack 196, win 8192, options [nop,nop,TS val 1052989605 ecr 1536115097], length 41
00:27:30.203696 IP sea09s16-in-f30.1e100.net.https > d-69-91-148-226.dhcp4.washington.edu.56701: Flags [.], ack 2087, win 692, options [nop,nop,TS val 1368583758 ecr 1052989599], length 0
00:27:30.204409 IP dns1.cac.washington.edu.domain > d-69-91-148-226.dhcp4.washington.edu.65524: 24305 4/4/2 A 107.22.197.188, A 50.16.225.31, A 54.243.241.208, A 54.243.120.151 (310)
00:27:30.212107 IP 199.27.79.130.https > d-69-91-148-226.dhcp4.washington.edu.56838: Flags [.], ack 518, win 31, options [nop,nop,TS val 1392941335 ecr 1052989589], length 0
00:27:30.213403 IP 199.27.79.130.https > d-69-91-148-226.dhcp4.washington.edu.56838: Flags [P.], seq 1:142, ack 518, win 31, options [nop,nop,TS val 1392941335 ecr 1052989589], length 141
00:27:30.213438 IP d-69-91-148-226.dhcp4.washington.edu.56703 > pe-in-f105.1e100.net.https: Flags [P.], seq 652933979:652934995, ack 3145293273, win 8192, options [nop,nop,TS val 1052989615 ecr 825654274], length 1016
00:27:30.213438 IP d-69-91-148-226.dhcp4.washington.edu.56838 > 199.27.79.130.https: Flags [.], ack 142, win 8235, options [nop,nop,TS val 1052989615 ecr 1392941335], length 0
00:27:30.213821 IP d-69-91-148-226.dhcp4.washington.edu.56838 > 199.27.79.130.https: Flags [P.], seq 518:569, ack 142, win 8235, options [nop,nop,TS val 1052989615 ecr 1392941335], length 51
00:27:30.226275 IP pe-in-f105.1e100.net.https > d-69-91-148-226.dhcp4.washington.edu.56703: Flags [P.], seq 1:58, ack 1016, win 782, options [nop,nop,TS val 825656215 ecr 1052989615], length 57
00:27:30.226346 IP d-69-91-148-226.dhcp4.washington.edu.56703 > pe-in-f105.1e100.net.https: Flags [.], ack 58, win 8188, options [nop,nop,TS val 1052989627 ecr 825656215], length 0
00:27:30.227415 IP pe-in-f105.1e100.net.https > d-69-91-148-226.dhcp4.washington.edu.56703: Flags [P.], seq 58:178, ack 1016, win 782, options [nop,nop,TS val 825656215 ecr 1052989615], length 120
00:27:30.227463 IP d-69-91-148-226.dhcp4.washington.edu.56703 > pe-in-f105.1e100.net.https: Flags [.], ack 178, win 8184, options [nop,nop,TS val 1052989628 ecr 825656215], length 0
00:27:30.227741 IP d-69-91-148-226.dhcp4.washington.edu.56703 > pe-in-f105.1e100.net.https: Flags [P.], seq 1016:1057, ack 178, win 8192, options [nop,nop,TS val 1052989628 ecr 825656215], length 41
00:27:30.243506 IP 199.27.79.130.https > d-69-91-148-226.dhcp4.washington.edu.56838: Flags [.], ack 569, win 31, options [nop,nop,TS val 1392941342 ecr 1052989615], length 0
00:27:30.246666 IP sea09s17-in-f25.1e100.net.https > d-69-91-148-226.dhcp4.washington.edu.56702: Flags [.], ack 1081, win 529, options [nop,nop,TS val 1536115146 ecr 1052989605], length 0
00:27:30.253540 IP ec2-50-16-225-31.compute-1.amazonaws.com.https > d-69-91-148-226.dhcp4.washington.edu.56840: Flags [S.], seq 1675905108, ack 4152381367, win 14480, options [mss 1386,sackOK,TS val 249731457 ecr 1052989590,nop,wscale 8], length 0
00:27:30.253712 IP d-69-91-148-226.dhcp4.washington.edu.56840 > ec2-50-16-225-31.compute-1.amazonaws.com.https: Flags [.], ack 1, win 8244, options [nop,nop,TS val 1052989653 ecr 249731457], length 0
00:27:30.253928 IP ec2-50-16-225-31.compute-1.amazonaws.com.https > d-69-91-148-226.dhcp4.washington.edu.56839: Flags [S.], seq 2529212526, ack 683168605, win 14480, options [mss 1386,sackOK,TS val 249731457 ecr 1052989590,nop,wscale 8], length 0
00:27:30.254055 IP d-69-91-148-226.dhcp4.washington.edu.56839 > ec2-50-16-225-31.compute-1.amazonaws.com.https: Flags [.], ack 1, win 8244, options [nop,nop,TS val 1052989653 ecr 249731457], length 0
00:27:30.254295 IP d-69-91-148-226.dhcp4.washington.edu.56840 > ec2-50-16-225-31.compute-1.amazonaws.com.https: Flags [P.], seq 1:214, ack 1, win 8244, options [nop,nop,TS val 1052989653 ecr 249731457], length 213
00:27:30.254646 IP d-69-91-148-226.dhcp4.washington.edu.56839 > ec2-50-16-225-31.compute-1.amazonaws.com.https: Flags [P.], seq 1:214, ack 1, win 8244, options [nop,nop,TS val 1052989654 ecr 249731457], length 213
00:27:30.279250 IP pe-in-f105.1e100.net.https > d-69-91-148-226.dhcp4.washington.edu.56703: Flags [.], ack 1057, win 782, options [nop,nop,TS val 825656267 ecr 1052989628], length 0
00:27:30.282677 IP 198.41.209.190.https > d-69-91-148-226.dhcp4.washington.edu.56692: Flags [P.], seq 1:317, ack 4166, win 166, length 316
00:27:30.282768 IP d-69-91-148-226.dhcp4.washington.edu.56692 > 198.41.209.190.https: Flags [.], ack 317, win 16364, length 0
00:27:30.283777 IP 198.41.209.190.https > d-69-91-148-226.dhcp4.washington.edu.56692: Flags [P.], seq 317:354, ack 4166, win 166, length 37
00:27:30.283833 IP d-69-91-148-226.dhcp4.washington.edu.56692 > 198.41.209.190.https: Flags [.], ack 354, win 16381, length 0
00:27:30.322282 IP ec2-50-16-225-31.compute-1.amazonaws.com.https > d-69-91-148-226.dhcp4.washington.edu.56839: Flags [.], ack 214, win 61, options [nop,nop,TS val 249731474 ecr 1052989654], length 0
00:27:30.322287 IP ec2-50-16-225-31.compute-1.amazonaws.com.https > d-69-91-148-226.dhcp4.washington.edu.56840: Flags [.], ack 214, win 61, options [nop,nop,TS val 249731474 ecr 1052989653], length 0
00:27:30.324590 IP ec2-50-16-225-31.compute-1.amazonaws.com.https > d-69-91-148-226.dhcp4.washington.edu.56840: Flags [.], seq 1:1375, ack 214, win 61, options [nop,nop,TS val 249731475 ecr 1052989653], length 1374
00:27:30.324749 IP ec2-50-16-225-31.compute-1.amazonaws.com.https > d-69-91-148-226.dhcp4.washington.edu.56839: Flags [.], seq 1:1375, ack 214, win 61, options [nop,nop,TS val 249731475 ecr 1052989654], length 1374
00:27:30.325029 IP ec2-50-16-225-31.compute-1.amazonaws.com.https > d-69-91-148-226.dhcp4.washington.edu.56839: Flags [.], seq 1375:2749, ack 214, win 61, options [nop,nop,TS val 249731475 ecr 1052989654], length 1374
00:27:30.325032 IP ec2-50-16-225-31.compute-1.amazonaws.com.https > d-69-91-148-226.dhcp4.washington.edu.56840: Flags [.], seq 1375:2749, ack 214, win 61, options [nop,nop,TS val 249731475 ecr 1052989653], length 1374
00:27:30.325033 IP ec2-50-16-225-31.compute-1.amazonaws.com.https > d-69-91-148-226.dhcp4.washington.edu.56839: Flags [P.], seq 2749:3382, ack 214, win 61, options [nop,nop,TS val 249731475 ecr 1052989654], length 633
00:27:30.325034 IP ec2-50-16-225-31.compute-1.amazonaws.com.https > d-69-91-148-226.dhcp4.washington.edu.56840: Flags [P.], seq 2749:3382, ack 214, win 61, options [nop,nop,TS val 249731475 ecr 1052989653], length 633
00:27:30.325095 IP d-69-91-148-226.dhcp4.washington.edu.56839 > ec2-50-16-225-31.compute-1.amazonaws.com.https: Flags [.], ack 2749, win 8106, options [nop,nop,TS val 1052989721 ecr 249731475], length 0
00:27:30.325096 IP d-69-91-148-226.dhcp4.washington.edu.56840 > ec2-50-16-225-31.compute-1.amazonaws.com.https: Flags [.], ack 2749, win 8106, options [nop,nop,TS val 1052989721 ecr 249731475], length 0
00:27:30.325096 IP d-69-91-148-226.dhcp4.washington.edu.56839 > ec2-50-16-225-31.compute-1.amazonaws.com.https: Flags [.], ack 3382, win 8066, options [nop,nop,TS val 1052989721 ecr 249731475], length 0
00:27:30.325149 IP d-69-91-148-226.dhcp4.washington.edu.56840 > ec2-50-16-225-31.compute-1.amazonaws.com.https: Flags [.], ack 3382, win 8066, options [nop,nop,TS val 1052989721 ecr 249731475], length 0
00:27:30.328495 IP d-69-91-148-226.dhcp4.washington.edu.56839 > ec2-50-16-225-31.compute-1.amazonaws.com.https: Flags [P.], seq 214:340, ack 3382, win 8192, options [nop,nop,TS val 1052989724 ecr 249731475], length 126
00:27:30.331376 IP d-69-91-148-226.dhcp4.washington.edu.56840 > ec2-50-16-225-31.compute-1.amazonaws.com.https: Flags [P.], seq 214:340, ack 3382, win 8192, options [nop,nop,TS val 1052989726 ecr 249731475], length 126
00:27:30.397157 IP ec2-50-16-225-31.compute-1.amazonaws.com.https > d-69-91-148-226.dhcp4.washington.edu.56839: Flags [P.], seq 3382:3624, ack 340, win 61, options [nop,nop,TS val 249731493 ecr 1052989724], length 242
00:27:30.397296 IP d-69-91-148-226.dhcp4.washington.edu.56839 > ec2-50-16-225-31.compute-1.amazonaws.com.https: Flags [.], ack 3624, win 8176, options [nop,nop,TS val 1052989791 ecr 249731493], length 0
00:27:30.400121 IP ec2-50-16-225-31.compute-1.amazonaws.com.https > d-69-91-148-226.dhcp4.washington.edu.56840: Flags [P.], seq 3382:3624, ack 340, win 61, options [nop,nop,TS val 249731493 ecr 1052989726], length 242
00:27:30.400211 IP d-69-91-148-226.dhcp4.washington.edu.56840 > ec2-50-16-225-31.compute-1.amazonaws.com.https: Flags [.], ack 3624, win 8176, options [nop,nop,TS val 1052989793 ecr 249731493], length 0
00:27:30.400714 IP d-69-91-148-226.dhcp4.washington.edu.56840 > ec2-50-16-225-31.compute-1.amazonaws.com.https: Flags [P.], seq 340:1004, ack 3624, win 8192, options [nop,nop,TS val 1052989793 ecr 249731493], length 664
00:27:30.470022 IP ec2-50-16-225-31.compute-1.amazonaws.com.https > d-69-91-148-226.dhcp4.washington.edu.56840: Flags [P.], seq 3624:4489, ack 1004, win 66, options [nop,nop,TS val 249731511 ecr 1052989793], length 865
00:27:30.470183 IP d-69-91-148-226.dhcp4.washington.edu.56840 > ec2-50-16-225-31.compute-1.amazonaws.com.https: Flags [.], ack 4489, win 8137, options [nop,nop,TS val 1052989862 ecr 249731511], length 0
00:27:30.507036 ARP, Request who-has d-173-250-177-12.dhcp4.washington.edu tell d-173-250-177-12.dhcp4.washington.edu, length 42
00:27:30.632533 IP d-69-91-148-226.dhcp4.washington.edu.59532 > dns1.cac.washington.edu.domain: 3824+ PTR? 165.70.7.96.in-addr.arpa. (42)
00:27:30.682606 IP dns1.cac.washington.edu.domain > d-69-91-148-226.dhcp4.washington.edu.59532: 3824 1/8/9 PTR a96-7-70-165.deploy.akamaitechnologies.com. (435)
00:27:30.684466 IP d-69-91-148-226.dhcp4.washington.edu.61387 > dns1.cac.washington.edu.domain: 39663+ PTR? 12.177.250.173.in-addr.arpa. (45)
00:27:30.686306 IP dns1.cac.washington.edu.domain > d-69-91-148-226.dhcp4.washington.edu.61387: 39663* 1/2/2 PTR D-173-250-177-12.dhcp4.washington.edu. (172)
00:27:30.686806 IP d-69-91-148-226.dhcp4.washington.edu.54265 > dns1.cac.washington.edu.domain: 44949+ PTR? 3.148.91.69.in-addr.arpa. (42)
00:27:30.688819 IP dns1.cac.washington.edu.domain > d-69-91-148-226.dhcp4.washington.edu.54265: 44949* 1/3/4 PTR ae3--2888.uwar-atg-1.infra.washington.edu. (245)
00:27:30.689442 IP d-69-91-148-226.dhcp4.washington.edu.56750 > dns1.cac.washington.edu.domain: 53294+ PTR? 113.0.0.224.in-addr.arpa. (42)
00:27:30.713038 IP dns1.cac.washington.edu.domain > d-69-91-148-226.dhcp4.washington.edu.56750: 53294 NXDomain 0/1/0 (99)
00:27:30.713796 IP d-69-91-148-226.dhcp4.washington.edu.65049 > dns1.cac.washington.edu.domain: 56878+ PTR? 175.79.27.199.in-addr.arpa. (44)
00:27:30.795522 IP dns1.cac.washington.edu.domain > d-69-91-148-226.dhcp4.washington.edu.65049: 56878 NXDomain 0/1/0 (98)
00:27:30.796395 IP d-69-91-148-226.dhcp4.washington.edu.62589 > dns1.cac.washington.edu.domain: 64590+ PTR? 1.120.95.128.in-addr.arpa. (43)
00:27:30.798427 IP dns1.cac.washington.edu.domain > d-69-91-148-226.dhcp4.washington.edu.62589: 64590* 1/3/4 PTR dns1.cac.washington.edu. (224)
00:27:30.799112 IP d-69-91-148-226.dhcp4.washington.edu.65251 > dns1.cac.washington.edu.domain: 22497+ PTR? 180.216.184.93.in-addr.arpa. (45)
00:27:30.813111 IP ae3--2888.uwar-atg-1.infra.washington.edu > 224.0.0.113: igmp query v2 [max resp time 10] [gaddr 224.0.0.113]
00:27:30.818963 IP dns1.cac.washington.edu.domain > d-69-91-148-226.dhcp4.washington.edu.65251: 22497 NXDomain 0/1/0 (116)
00:27:30.819809 IP d-69-91-148-226.dhcp4.washington.edu.56579 > dns1.cac.washington.edu.domain: 17185+ PTR? 190.209.41.198.in-addr.arpa. (45)
00:27:30.842872 IP dns1.cac.washington.edu.domain > d-69-91-148-226.dhcp4.washington.edu.56579: 17185 NXDomain 0/0/0 (45)
00:27:30.843655 IP d-69-91-148-226.dhcp4.washington.edu.62045 > dns1.cac.washington.edu.domain: 25323+ PTR? 154.33.194.173.in-addr.arpa. (45)
00:27:30.846169 IP dns1.cac.washington.edu.domain > d-69-91-148-226.dhcp4.washington.edu.62045: 25323 1/4/4 PTR sea09s17-in-f26.1e100.net. (230)
00:27:30.846792 IP d-69-91-148-226.dhcp4.washington.edu.57606 > dns1.cac.washington.edu.domain: 36876+ PTR? 130.79.27.199.in-addr.arpa. (44)
00:27:30.851636 IP dns1.cac.washington.edu.domain > d-69-91-148-226.dhcp4.washington.edu.57606: 36876 NXDomain 0/1/0 (98)
00:27:30.852498 IP d-69-91-148-226.dhcp4.washington.edu.57597 > dns1.cac.washington.edu.domain: 10613+ PTR? 126.33.194.173.in-addr.arpa. (45)
00:27:30.854856 IP dns1.cac.washington.edu.domain > d-69-91-148-226.dhcp4.washington.edu.57597: 10613 1/4/4 PTR sea09s16-in-f30.1e100.net. (230)
00:27:30.855482 IP d-69-91-148-226.dhcp4.washington.edu.62283 > dns1.cac.washington.edu.domain: 39448+ PTR? 153.33.194.173.in-addr.arpa. (45)
00:27:30.858054 IP dns1.cac.washington.edu.domain > d-69-91-148-226.dhcp4.washington.edu.62283: 39448 1/4/4 PTR sea09s17-in-f25.1e100.net. (230)
00:27:30.858805 IP d-69-91-148-226.dhcp4.washington.edu.55355 > dns1.cac.washington.edu.domain: 40402+ PTR? 31.225.16.50.in-addr.arpa. (43)
00:27:30.882308 IP dns1.cac.washington.edu.domain > d-69-91-148-226.dhcp4.washington.edu.55355: 40402 1/5/5 PTR ec2-50-16-225-31.compute-1.amazonaws.com. (302)
00:27:30.883292 IP d-69-91-148-226.dhcp4.washington.edu.62678 > dns1.cac.washington.edu.domain: 17519+ PTR? 105.20.125.74.in-addr.arpa. (44)
00:27:30.885496 IP dns1.cac.washington.edu.domain > d-69-91-148-226.dhcp4.washington.edu.62678: 17519 1/4/4 PTR pe-in-f105.1e100.net. (224)
00:27:30.915523 IP ae3--2888.uwar-atg-1.infra.washington.edu > 224.0.0.252: igmp query v2 [max resp time 10] [gaddr 224.0.0.252]
00:27:30.916046 IP ae3--2888.uwar-atg-1.infra.washington.edu > 224.0.0.252: igmp query v2 [max resp time 10] [gaddr 224.0.0.252]
00:27:31.374254 IP d-69-91-148-226.dhcp4.washington.edu.56715 > r2.ycpi.vip.gq1.yahoo.net.https: Flags [.], seq 3130991927:3130993301, ack 2524014000, win 8192, options [nop,nop,TS val 1052990764 ecr 1660893968], length 1374
00:27:31.374255 IP d-69-91-148-226.dhcp4.washington.edu.56715 > r2.ycpi.vip.gq1.yahoo.net.https: Flags [P.], seq 1374:2454, ack 1, win 8192, options [nop,nop,TS val 1052990764 ecr 1660893968], length 1080
00:27:31.382687 IP r2.ycpi.vip.gq1.yahoo.net.https > d-69-91-148-226.dhcp4.washington.edu.56715: Flags [.], ack 1374, win 250, options [nop,nop,TS val 1660902732 ecr 1052990764], length 0
00:27:31.384442 IP r2.ycpi.vip.gq1.yahoo.net.https > d-69-91-148-226.dhcp4.washington.edu.56715: Flags [.], ack 2454, win 250, options [nop,nop,TS val 1660902733 ecr 1052990764], length 0
00:27:31.465571 IP r2.ycpi.vip.gq1.yahoo.net.https > d-69-91-148-226.dhcp4.washington.edu.56715: Flags [P.], seq 1:470, ack 2454, win 251, options [nop,nop,TS val 1660902815 ecr 1052990764], length 469
00:27:31.465652 IP d-69-91-148-226.dhcp4.washington.edu.56715 > r2.ycpi.vip.gq1.yahoo.net.https: Flags [.], ack 470, win 8162, options [nop,nop,TS val 1052990853 ecr 1660902815], length 0
00:27:31.466714 IP r2.ycpi.vip.gq1.yahoo.net.https > d-69-91-148-226.dhcp4.washington.edu.56715: Flags [.], seq 470:1844, ack 2454, win 251, options [nop,nop,TS val 1660902815 ecr 1052990764], length 1374
00:27:31.467944 IP r2.ycpi.vip.gq1.yahoo.net.https > d-69-91-148-226.dhcp4.washington.edu.56715: Flags [P.], seq 1844:2772, ack 2454, win 251, options [nop,nop,TS val 1660902815 ecr 1052990764], length 928
00:27:31.468040 IP d-69-91-148-226.dhcp4.washington.edu.56715 > r2.ycpi.vip.gq1.yahoo.net.https: Flags [.], ack 2772, win 8134, options [nop,nop,TS val 1052990855 ecr 1660902815], length 0
00:27:31.887951 IP d-69-91-148-226.dhcp4.washington.edu.63497 > dns1.cac.washington.edu.domain: 39672+ PTR? 252.0.0.224.in-addr.arpa. (42)
00:27:31.894268 IP dns1.cac.washington.edu.domain > d-69-91-148-226.dhcp4.washington.edu.63497: 39672 NXDomain 0/1/0 (99)
00:27:31.895007 IP d-69-91-148-226.dhcp4.washington.edu.55762 > dns1.cac.washington.edu.domain: 36781+ PTR? 31.44.71.208.in-addr.arpa. (43)
00:27:31.939543 IP ae3--2888.uwar-atg-1.infra.washington.edu > 224.0.0.252: igmp query v2 [max resp time 10] [gaddr 224.0.0.252]
00:27:31.953542 IP dns1.cac.washington.edu.domain > d-69-91-148-226.dhcp4.washington.edu.55762: 36781 1/5/5 PTR r2.ycpi.vip.gq1.yahoo.net. (261)
00:27:33.647316 IP d-69-91-148-226.dhcp4.washington.edu.17500 > broadcasthost.17500: UDP, length 104
00:27:33.647519 IP d-69-91-148-226.dhcp4.washington.edu.17500 > 69.91.149.255.17500: UDP, length 104
00:27:33.956857 IP d-69-91-148-226.dhcp4.washington.edu.58096 > dns1.cac.washington.edu.domain: 49651+ PTR? 255.255.255.255.in-addr.arpa. (46)
00:27:33.961879 IP dns1.cac.washington.edu.domain > d-69-91-148-226.dhcp4.washington.edu.58096: 49651* 0/1/0 (81)
00:27:33.962716 IP d-69-91-148-226.dhcp4.washington.edu.58545 > dns1.cac.washington.edu.domain: 16935+ PTR? 255.149.91.69.in-addr.arpa. (44)
00:27:33.965053 IP dns1.cac.washington.edu.domain > d-69-91-148-226.dhcp4.washington.edu.58545: 16935 NXDomain* 0/1/0 (117)
00:27:35.187703 IP d-69-91-148-226.dhcp4.washington.edu.57899 > dns2.cac.washington.edu.domain: 65083+ PTR? b._dns-sd._udp.0.148.91.69.in-addr.arpa. (57)
00:27:35.187704 IP d-69-91-148-226.dhcp4.washington.edu.56138 > dns2.cac.washington.edu.domain: 6028+ PTR? db._dns-sd._udp.0.148.91.69.in-addr.arpa. (58)
00:27:35.187856 IP d-69-91-148-226.dhcp4.washington.edu.64131 > dns2.cac.washington.edu.domain: 13306+ PTR? lb._dns-sd._udp.0.148.91.69.in-addr.arpa. (58)
00:27:35.187857 IP d-69-91-148-226.dhcp4.washington.edu.53133 > dns2.cac.washington.edu.domain: 1696+ PTR? b._dns-sd._udp.0.131.16.172.in-addr.arpa. (58)
00:27:35.187857 IP d-69-91-148-226.dhcp4.washington.edu.58081 > dns2.cac.washington.edu.domain: 60663+ PTR? db._dns-sd._udp.0.131.16.172.in-addr.arpa. (59)
00:27:35.187857 IP d-69-91-148-226.dhcp4.washington.edu.51171 > dns2.cac.washington.edu.domain: 37465+ PTR? lb._dns-sd._udp.0.131.16.172.in-addr.arpa. (59)
00:27:35.187857 IP d-69-91-148-226.dhcp4.washington.edu.53451 > dns2.cac.washington.edu.domain: 1447+ PTR? b._dns-sd._udp.dhcp4.washington.edu. (53)
00:27:35.187858 IP d-69-91-148-226.dhcp4.washington.edu.49707 > dns2.cac.washington.edu.domain: 10846+ PTR? db._dns-sd._udp.dhcp4.washington.edu. (54)
00:27:35.187858 IP d-69-91-148-226.dhcp4.washington.edu.55151 > dns2.cac.washington.edu.domain: 213+ PTR? lb._dns-sd._udp.dhcp4.washington.edu. (54)
00:27:35.193492 IP dns2.cac.washington.edu.domain > d-69-91-148-226.dhcp4.washington.edu.57899: 65083 NXDomain* 0/1/0 (130)
00:27:35.193642 IP dns2.cac.washington.edu.domain > d-69-91-148-226.dhcp4.washington.edu.64131: 13306 NXDomain* 0/1/0 (131)
00:27:35.194118 IP dns2.cac.washington.edu.domain > d-69-91-148-226.dhcp4.washington.edu.56138: 6028 NXDomain* 0/1/0 (131)
00:27:35.194122 IP dns2.cac.washington.edu.domain > d-69-91-148-226.dhcp4.washington.edu.53133: 1696 NXDomain* 0/1/0 (131)
00:27:35.194646 IP dns2.cac.washington.edu.domain > d-69-91-148-226.dhcp4.washington.edu.58081: 60663 NXDomain* 0/1/0 (132)
00:27:35.194738 IP dns2.cac.washington.edu.domain > d-69-91-148-226.dhcp4.washington.edu.53451: 1447 NXDomain* 0/1/0 (112)
00:27:35.194974 IP dns2.cac.washington.edu.domain > d-69-91-148-226.dhcp4.washington.edu.49707: 10846 NXDomain* 0/1/0 (113)
00:27:35.194977 IP dns2.cac.washington.edu.domain > d-69-91-148-226.dhcp4.washington.edu.55151: 213 NXDomain* 0/1/0 (113)
00:27:35.195101 IP dns2.cac.washington.edu.domain > d-69-91-148-226.dhcp4.washington.edu.51171: 37465 NXDomain* 0/1/0 (132)
00:27:35.562340 IP d-69-91-148-226.dhcp4.washington.edu.56839 > ec2-50-16-225-31.compute-1.amazonaws.com.https: Flags [P.], seq 340:371, ack 3624, win 8192, options [nop,nop,TS val 1052994944 ecr 249731493], length 31
00:27:35.562427 IP d-69-91-148-226.dhcp4.washington.edu.56839 > ec2-50-16-225-31.compute-1.amazonaws.com.https: Flags [F.], seq 371, ack 3624, win 8192, options [nop,nop,TS val 1052994944 ecr 249731493], length 0
00:27:35.562536 IP d-69-91-148-226.dhcp4.washington.edu.56838 > 199.27.79.130.https: Flags [P.], seq 569:600, ack 142, win 8235, options [nop,nop,TS val 1052994944 ecr 1392941342], length 31
00:27:35.562546 IP d-69-91-148-226.dhcp4.washington.edu.56838 > 199.27.79.130.https: Flags [F.], seq 600, ack 142, win 8235, options [nop,nop,TS val 1052994944 ecr 1392941342], length 0
00:27:35.562675 IP d-69-91-148-226.dhcp4.washington.edu.56836 > 199.27.79.175.https: Flags [P.], seq 569:600, ack 142, win 8235, options [nop,nop,TS val 1052994944 ecr 1413988908], length 31
00:27:35.562684 IP d-69-91-148-226.dhcp4.washington.edu.56836 > 199.27.79.175.https: Flags [F.], seq 600, ack 142, win 8235, options [nop,nop,TS val 1052994944 ecr 1413988908], length 0
00:27:35.590584 IP 199.27.79.175.https > d-69-91-148-226.dhcp4.washington.edu.56836: Flags [.], ack 600, win 31, options [nop,nop,TS val 1413990288 ecr 1052994944], length 0
00:27:35.590589 IP 199.27.79.175.https > d-69-91-148-226.dhcp4.washington.edu.56836: Flags [.], ack 601, win 31, options [nop,nop,TS val 1413990288 ecr 1052994944], length 0
00:27:35.590717 IP d-69-91-148-226.dhcp4.washington.edu.56836 > 199.27.79.175.https: Flags [F.], seq 600, ack 142, win 8235, options [nop,nop,TS val 1052994972 ecr 1413990288], length 0
00:27:35.590717 IP d-69-91-148-226.dhcp4.washington.edu.56836 > 199.27.79.175.https: Flags [.], ack 142, win 8235, options [nop,nop,TS val 1052994972 ecr 1413990288], length 0
00:27:35.591130 IP 199.27.79.130.https > d-69-91-148-226.dhcp4.washington.edu.56838: Flags [.], ack 600, win 31, options [nop,nop,TS val 1392942680 ecr 1052994944], length 0
00:27:35.591215 IP d-69-91-148-226.dhcp4.washington.edu.56838 > 199.27.79.130.https: Flags [F.], seq 600, ack 142, win 8235, options [nop,nop,TS val 1052994972 ecr 1392942680], length 0
00:27:35.591550 IP 199.27.79.130.https > d-69-91-148-226.dhcp4.washington.edu.56838: Flags [.], ack 601, win 31, options [nop,nop,TS val 1392942680 ecr 1052994944], length 0
00:27:35.591616 IP d-69-91-148-226.dhcp4.washington.edu.56838 > 199.27.79.130.https: Flags [.], ack 142, win 8235, options [nop,nop,TS val 1052994972 ecr 1392942680], length 0
00:27:35.592292 IP 199.27.79.175.https > d-69-91-148-226.dhcp4.washington.edu.56836: Flags [F.], seq 142, ack 601, win 31, options [nop,nop,TS val 1413990288 ecr 1052994944], length 0
00:27:35.592294 IP 199.27.79.130.https > d-69-91-148-226.dhcp4.washington.edu.56838: Flags [F.], seq 142, ack 601, win 31, options [nop,nop,TS val 1392942680 ecr 1052994944], length 0
00:27:35.592341 IP d-69-91-148-226.dhcp4.washington.edu.56836 > 199.27.79.175.https: Flags [.], ack 143, win 8235, options [nop,nop,TS val 1052994973 ecr 1413990288], length 0
